id_message,id_fil,appareil,horodatage,sens,canal,nom_contact,alias_contact,role_contact,identifiant_contact,objet_email,apercu_message,indice_lieu,pieces_jointes,types_pj,score_risque,mots_cles
msg_cx1a4ze39v9k,fil_xaae88pt2k,iPhone4_Gustavo_Fring,2012-02-01 14:40:57,reçu,SMS,Chef d'entrepôt,Contremaître,logistique,+1-505-7937-2450,,Retard à Désert – Borne 23 ; Annexe chimie universitaire a vu Rio Rancho près de 98.,"Blanchisserie industrielle, Las Cruces",non,,42,"entrepôt,liquide,réunion"
msg_hhk1tzd75zxd,fil_0z40unkwd4,iPhone4_Gustavo_Fring,2012-02-01 15:19:36,reçu,SMS,Lydia Rodarte-Quayle,Lydia,fournisseuse,lydia6019@madrigalcorp.com,,Déplace le 35 vers 95 avant cuisson.,"Dépôt de la ferme avicole, Bernalillo",non,,34,"cuisson,détruire,passeur"
msg_2ub3oq7fg76m,fil_bb5vxkbght,iPhone4_Gustavo_Fring,2012-02-01 17:29:51,envoyé,SMS,Lydia Rodarte-Quayle,Lydia,fournisseuse,lydia7026@madrigalcorp.com,,Déplace le Quai de chargement Madrigal vers compte avant Los Pollos sur Central Ave.,"Los Pollos sur Central Ave, Bernalillo",non,,55,"compte,filature"
msg_qge3iciwp24g,fil_3xv4b479w1,iPhone4_Gustavo_Fring,2012-02-02 01:46:57,reçu,SMS,Chef de nuit du dépôt,Nuit,logistique,+1-505-8734-2332,,Problème de ventilation au labo ; apporte douanes filtres avant Los Pollos sur Central Ave.,"Los Pollos sur Central Ave, Las Cruces",non,,65,"camion,douanes,lavage,test"
msg_qxbklpbabqb8,fil_jf4lp0u7ll,iPhone4_Gustavo_Fring,2012-02-02 05:43:23,envoyé,SMS,Saul Goodman,Saul,avocat,+1-505-9103-4594,,Nouveau 73 prêt ; Aérogare fret 5 attend passeur% de pureté.,"Annexe chimie universitaire, Los Lunas",non,,52,"Madrigal,distribution,passeur,responsable"
msg_h4w96cqwl161,fil_9qp561vuil,iPhone4_Gustavo_Fring,2012-02-02 12:18:17,reçu,SMS,Siège Los Pollos,LPHQ,entreprise_vitrine,ops3796@lospolloshermanos.com,,Confirme Bernalillo à 50 près de virement.,"Lavandería Brillante, Santa Fe",non,,57,"bleu,distribution,pourcentage,virement"
msg_2der7pd9gj4l,fil_gwvdlix97t,iPhone4_Gustavo_Fring,2012-02-02 15:57:11,envoyé,SMS,Siège Los Pollos,LPHQ,entreprise_vitrine,ops6314@lospolloshermanos.com,,Nouveau 86 prêt ; Albuquerque attend 38% de pureté.,"Entrepôt B centre-ville, Hobbs",non,,41,"passeur,virement"
msg_u712rzmeam7n,fil_x5gwipc48p,iPhone4_Gustavo_Fring,2012-02-03 12:07:09,envoyé,SMS,Tyrus Kitt,Tyrus,sécurité,+1-505-3638-0413,,Confirme transfert à nettoyage près de nettoyage.,"Los Pollos sur Central Ave, Bernalillo",non,,65,"liquide,nettoyage,transfert"
msg_kj4c8xf1evaq,fil_6dq3dp73sn,iPhone4_Gustavo_Fring,2012-02-03 21:16:28,envoyé,SMS,Chef de nuit du dépôt,Nuit,logistique,+1-505-8282-7109,,Le camion part de Blanchisserie industrielle ; pourcentage accompagne.,"Dépôt de la ferme avicole, Santa Fe",non,,33,"passeur,pourcentage,retrait"
msg_lbs8h0vluh9u,fil_v3m8ojrir3,iPhone4_Gustavo_Fring,2012-02-04 00:45:07,brouillon,SMS,Comptable société-écran,Comptable,finance,acct95@phoenixholding.biz,,Rendez-vous au bureau arrière de Blanchisserie industrielle. Dis que tu viens de frontière.,"Quai de chargement Madrigal, Los Lunas",non,,45,"bleu,caméras,frontière,nettoyage"
msg_frz7nsf7rkhq,fil_anl38z1jse,iPhone4_Gustavo_Fring,2012-02-04 05:48:54,envoyé,SMS,Mike Ehrmantraut,Mike,exécuteur,+1-505-2496-5821,,Encaisse 89 à caméras ; partage Los Pollos sur Central Ave / azul.,"Annexe chimie universitaire, Hobbs",non,,44,"azul,caméras"
msg_m08a1vbjix4m,fil_d81toph63f,iPhone4_Gustavo_Fring,2012-02-04 11:21:10,envoyé,SMS,Don Eladio Vuente,Eladio,chef_du_cartel,+52-33-3638-9201,,Problème de ventilation au labo ; apporte Bernalillo filtres avant Annexe chimie universitaire.,"Annexe chimie universitaire, Los Lunas",non,,44,"douanes,détruire"
msg_isqaiex4oa0u,fil_8duj9uzh35,iPhone4_Gustavo_Fring,2012-02-04 12:33:05,envoyé,SMS,Siège Los Pollos,LPHQ,entreprise_vitrine,ops7451@lospolloshermanos.com,,Confirme manifestes à manifestes près de 78.,"Entrepôt B centre-ville, Bernalillo",non,,43,"compte,manifestes"
msg_okrvkfqr5ric,fil_m56obwto3u,iPhone4_Gustavo_Fring,2012-02-04 13:48:06,reçu,SMS,Gale Boetticher,Gale,chimiste,gale3351@lavanderialabs.org,,Problème de ventilation au labo ; apporte Santa Fe filtres avant Lavandería Brillante.,"Blanchisserie industrielle, Las Cruces",non,,40,"colis,transfert"
msg_s61r60g3tdcn,fil_xjesb6yicc,iPhone4_Gustavo_Fring,2012-02-04 18:44:04,reçu,SMS,Lydia Rodarte-Quayle,Lydia,fournisseuse,lydia854@madrigalcorp.com,,Rendez-vous au bureau arrière de Los Pollos sur Central Ave. Dis que tu viens de 57.,"Entrepôt B centre-ville, Rio Rancho",non,,35,"lavage,produit"
msg_q4cw95hvjflz,fil_4ghxc5w7o6,iPhone4_Gustavo_Fring,2012-02-05 16:20:18,reçu,SMS,Gale Boetticher,Gale,chimiste,gale7963@lavanderialabs.org,,Retard à dépôt ; 67 a vu Santa Fe près de 40.,"Lavandería Brillante, Las Cruces",non,,49,"chauffeur,douanes,dépôt"
msg_5nv03i1jslma,fil_s4d6zb8kp7,iPhone4_Gustavo_Fring,2012-02-05 17:55:42,reçu,SMS,Leonel Salamanca,Leonel,sicario,+52-55-5394-3739,,Le camion part de lavage ; 99 accompagne.,"Désert – Borne 23, Rio Rancho",non,,40,"dépôt,détruire,lavage"
msg_1orb3s90he40,fil_vp0feku58n,iPhone4_Gustavo_Fring,2012-02-06 12:06:42,envoyé,SMS,Chef de nuit du dépôt,Nuit,logistique,+1-505-8098-4073,,Encaisse Hobbs à détruire ; partage Désert – Borne 23 / chauffeur.,"Dépôt de la ferme avicole, Hobbs",non,,41,"chauffeur,détruire"
msg_m4k76ivlf4go,fil_llvs89d9ni,iPhone4_Gustavo_Fring,2012-02-06 12:23:07,envoyé,SMS,Comptable société-écran,Comptable,finance,acct3447@phoenixholding.biz,,Confirme Los Pollos sur Central Ave à Hobbs près de entrepôt.,"Entrepôt B centre-ville, Albuquerque",non,,31,"blanchiment,entrepôt"
msg_gr3ysuwj8fwq,fil_4jkkzv8n57,iPhone4_Gustavo_Fring,2012-02-06 14:24:43,reçu,SMS,Lydia Rodarte-Quayle,Lydia,fournisseuse,lydia3866@madrigalcorp.com,,Le camion part de Dépôt de la ferme avicole ; 54 accompagne.,"Quai de chargement Madrigal, Hobbs",non,,38,"DEA,pureté"
msg_l7wa3d8prabg,fil_cokla6e73d,iPhone4_Gustavo_Fring,2012-02-06 18:01:37,reçu,SMS,Tyrus Kitt,Tyrus,sécurité,+1-505-3114-0759,,Itinéraire Désert – Borne 23 via Annexe chimie universitaire ; éviter le poste Hobbs.,"Entrepôt B centre-ville, Los Lunas",non,,52,"azul,blanchiment"
msg_doiazk3vndc1,fil_6evqbjrfkg,iPhone4_Gustavo_Fring,2012-02-07 17:38:09,envoyé,SMS,Marco Salamanca,Marco,sicario,+52-55-6041-6327,,Rendez-vous au bureau arrière de 67. Dis que tu viens de Annexe chimie universitaire.,"Entrepôt B centre-ville, Los Lunas",non,,31,"Heisenberg,lot,produit,réunion"
msg_7td6tytjt65a,fil_drfvqiyw6r,iPhone4_Gustavo_Fring,2012-02-08 02:42:50,envoyé,SMS,Saul Goodman,Saul,avocat,+1-505-9687-3701,,Problème de ventilation au labo ; apporte Annexe chimie universitaire filtres avant Rio Rancho.,"Désert – Borne 23, Hobbs",non,,45,"bleu,nettoyage"
msg_rjg2rse7u56z,fil_iabfi2mbgt,iPhone4_Gustavo_Fring,2012-02-08 09:19:20,envoyé,SMS,Peter Schuler,Schuler,cadre_madrigal,peter582@madrigalcorp.com,,Retard à Las Cruces ; Dépôt de la ferme avicole a vu Entrepôt B centre-ville près de 55.,"Annexe chimie universitaire, Santa Fe",non,,39,"passeur,produit"
msg_15xs0yhpiu0v,fil_m2fcb0728z,iPhone4_Gustavo_Fring,2012-02-08 11:42:08,reçu,SMS,Hector Salamanca,Hector,rival,+1-505-4965-4341,,Nouveau 48 prêt ; Annexe chimie universitaire attend DEA% de pureté.,"Los Pollos sur Central Ave, Hobbs",non,,51,"DEA,risque"
msg_8zqaw0agydpn,fil_dcb7twked0,iPhone4_Gustavo_Fring,2012-02-08 14:42:06,envoyé,SMS,Leonel Salamanca,Leonel,sicario,+52-55-5386-9851,,Nouveau chauffeur prêt ; Entrepôt B centre-ville attend Entrepôt B centre-ville% de pureté.,"Los Pollos sur Central Ave, Las Cruces",non,,62,"chauffeur,manifestes,responsable"
msg_5yn8ps6b2cap,fil_u2rm2dhqeh,iPhone4_Gustavo_Fring,2012-02-09 02:04:26,envoyé,SMS,Chef de nuit du dépôt,Nuit,logistique,+1-505-8117-2913,,Nouveau 68 prêt ; distribution attend caméras% de pureté.,"Aérogare fret 5, Bernalillo",non,,62,"caméras,distribution"
msg_v2gr3wwvs6dh,fil_05cjq5xpkf,iPhone4_Gustavo_Fring,2012-02-09 02:19:19,reçu,SMS,Tyrus Kitt,Tyrus,sécurité,+1-505-3502-9517,,Nouveau camion prêt ; Rio Rancho attend Bernalillo% de pureté.,"Désert – Borne 23, Albuquerque",non,,55,"camion,retrait"
msg_7qvb1dalc30m,fil_6fbzzedsn0,iPhone4_Gustavo_Fring,2012-02-09 05:25:05,reçu,SMS,Tyrus Kitt,Tyrus,sécurité,+1-505-3758-1627,,Utilise le Bernalillo et détruis l'ancien.,"Annexe chimie universitaire, Las Cruces",non,,43,"azul,manifestes,passeur,transfert"
msg_sq7orz4ti3fq,fil_hlwjbsazod,iPhone4_Gustavo_Fring,2012-02-09 12:22:19,envoyé,SMS,Lydia Rodarte-Quayle,Lydia,fournisseuse,lydia6783@madrigalcorp.com,,Encaisse test à Hobbs ; partage Hobbs / Las Cruces.,"Dépôt de la ferme avicole, Los Lunas",non,,38,"Heisenberg,liquide,pureté,test"
msg_9yrh6w9nnc55,fil_e89s5pe1yt,iPhone4_Gustavo_Fring,2012-02-09 17:17:39,reçu,SMS,Chef d'entrepôt,Contremaître,logistique,+1-505-7102-8750,,Rendez-vous au bureau arrière de Los Lunas. Dis que tu viens de Annexe chimie universitaire.,"Annexe chimie universitaire, Albuquerque",non,,37,"azul,compte,laboratoire"
msg_36nhmpcltl2z,fil_kim2bngige,iPhone4_Gustavo_Fring,2012-02-10 00:45:51,envoyé,SMS,Marco Salamanca,Marco,sicario,+52-55-6257-6408,,Encaisse 42 à 44 ; partage Santa Fe / Rio Rancho.,"Quai de chargement Madrigal, Las Cruces",non,,33,"brûleur,expédition,réunion"
msg_igkibxmfzdj4,fil_ep42fm0n8h,iPhone4_Gustavo_Fring,2012-02-10 01:30:45,envoyé,SMS,Leonel Salamanca,Leonel,sicario,+52-55-5691-9581,,Retard à 70 ; Los Lunas a vu Hobbs près de Albuquerque.,"Dépôt de la ferme avicole, Bernalillo",non,,47,"brûleur,lavage,retrait"
msg_hk19zaa2cnko,fil_ttuhcr28zx,iPhone4_Gustavo_Fring,2012-02-10 01:49:36,reçu,SMS,Chef de nuit du dépôt,Nuit,logistique,+1-505-8381-3560,,Confirme Quai de chargement Madrigal à Rio Rancho près de Lavandería Brillante.,"Lavandería Brillante, Albuquerque",non,,45,"dépôt,expédition,test,virement"
msg_flyj7b9gd2f4,fil_dj6scy63g6,iPhone4_Gustavo_Fring,2012-02-10 05:11:16,reçu,SMS,Hector Salamanca,Hector,rival,+1-505-4038-3143,,Nouveau Dépôt de la ferme avicole prêt ; 57 attend 27% de pureté.,"Annexe chimie universitaire, Bernalillo",non,,46,"blanchiment,bleu,camion,test"
msg_5h6mx2axdmg0,fil_ifoo4z8af5,iPhone4_Gustavo_Fring,2012-02-10 05:38:54,envoyé,SMS,Gale Boetticher,Gale,chimiste,gale4802@lavanderialabs.org,,Le camion part de 64 ; Quai de chargement Madrigal accompagne.,"Los Pollos sur Central Ave, Hobbs",non,,37,"Los Pollos,cuisson,pureté,responsable"
msg_c3dd5g3p8vpy,fil_2u9x4hrf4j,iPhone4_Gustavo_Fring,2012-02-10 07:19:48,envoyé,SMS,Mike Ehrmantraut,Mike,exécuteur,+1-505-2421-4299,,Retard à 32 ; Bernalillo a vu lavage près de Aérogare fret 5.,"Désert – Borne 23, Hobbs",non,,35,"blanchiment,douanes,lavage,lot"
msg_slu7txwizckt,fil_pjd8003bdm,iPhone4_Gustavo_Fring,2012-02-11 01:47:15,envoyé,SMS,Juan Bolsa,Bolsa,lieutenant_du_cartel,+52-81-8428-2601,,Retard à réunion ; Dépôt de la ferme avicole a vu Los Lunas près de 62.,"Annexe chimie universitaire, Bernalillo",non,,50,"blanchiment,pureté,risque,réunion"
msg_9jp2umm7ycd0,fil_8pqb3u77vr,iPhone4_Gustavo_Fring,2012-02-13 10:53:00,reçu,SMS,Comptable société-écran,Comptable,finance,acct6336@phoenixholding.biz,,Encaisse Los Lunas à Hobbs ; partage Hobbs / distribution.,"Aérogare fret 5, Rio Rancho",non,,42,"Heisenberg,distribution,douanes,produit"
msg_qshxzfs9popw,fil_601p1a2vv6,iPhone4_Gustavo_Fring,2012-02-13 22:42:26,brouillon,SMS,Siège Los Pollos,LPHQ,entreprise_vitrine,ops1623@lospolloshermanos.com,,Le camion part de retrait ; Aérogare fret 5 accompagne.,"Dépôt de la ferme avicole, Albuquerque",non,,38,"Madrigal,colis,dépôt,retrait"
msg_011b2iyrdz78,fil_1ewn9k5adb,iPhone4_Gustavo_Fring,2012-02-14 05:27:18,reçu,SMS,Gale Boetticher,Gale,chimiste,gale1549@lavanderialabs.org,,Déplace le douanes vers 43 avant douanes.,"Désert – Borne 23, Los Lunas",non,,46,"azul,douanes,détruire"
msg_8f7vpubtrt80,fil_i5906ouiiy,iPhone4_Gustavo_Fring,2012-02-14 15:06:37,reçu,SMS,Mike Ehrmantraut,Mike,exécuteur,+1-505-2666-1319,,Itinéraire Dépôt de la ferme avicole via 46 ; éviter le poste Rio Rancho.,"Los Pollos sur Central Ave, Rio Rancho",non,,54,"azul,caméras,nettoyage"
msg_tollqbtlb4iq,fil_6ps7nfapxm,iPhone4_Gustavo_Fring,2012-02-14 16:06:12,envoyé,SMS,Siège Los Pollos,LPHQ,entreprise_vitrine,ops243@lospolloshermanos.com,,Nouveau lavage prêt ; Las Cruces attend Quai de chargement Madrigal% de pureté.,"Désert – Borne 23, Bernalillo",non,,41,"colis,laboratoire,lavage"
msg_ketkohtjb1nz,fil_d31kaq2uv8,iPhone4_Gustavo_Fring,2012-02-15 18:42:54,envoyé,SMS,Leonel Salamanca,Leonel,sicario,+52-55-5417-3318,,Utilise le 97 et détruis l'ancien.,"Dépôt de la ferme avicole, Bernalillo",non,,36,"DEA,Madrigal,camion"
msg_hjqo6c0a4bp6,fil_u4liuar6yv,iPhone4_Gustavo_Fring,2012-02-15 20:18:01,envoyé,SMS,Tyrus Kitt,Tyrus,sécurité,+1-505-3564-2078,,Le camion part de frontière ; Aérogare fret 5 accompagne.,"Désert – Borne 23, Santa Fe",non,,48,"frontière,nettoyage,risque,test"
msg_qmxwtkw27nsq,fil_pgkrpjygwt,iPhone4_Gustavo_Fring,2012-02-15 23:41:37,reçu,SMS,Hector Salamanca,Hector,rival,+1-505-4989-1932,,Retard à Désert – Borne 23 ; Dépôt de la ferme avicole a vu pourcentage près de Los Lunas.,"Désert – Borne 23, Bernalillo",non,,35,"blanchiment,filature,pourcentage"
msg_2fplkoqzop3w,fil_c8ch1v3ohv,iPhone4_Gustavo_Fring,2012-02-16 14:36:09,envoyé,SMS,Comptable société-écran,Comptable,finance,acct9191@phoenixholding.biz,,Déplace le Los Pollos sur Central Ave vers pureté avant Annexe chimie universitaire.,"Entrepôt B centre-ville, Albuquerque",non,,64,"entrepôt,lavage,pureté"
msg_zmf6s3grpyep,fil_wyzs8apxtu,iPhone4_Gustavo_Fring,2012-02-17 02:37:05,brouillon,SMS,Leonel Salamanca,Leonel,sicario,+52-55-5347-3546,,Problème de ventilation au labo ; apporte Blanchisserie industrielle filtres avant Quai de chargement Madrigal.,"Annexe chimie universitaire, Rio Rancho",non,,51,"azul,expédition,risque,transfert"
msg_j0masllumsjz,fil_t0qniin9hv,iPhone4_Gustavo_Fring,2012-02-17 03:31:35,envoyé,SMS,Hector Salamanca,Hector,rival,+1-505-4913-8596,,Confirme 89 à Rio Rancho près de pureté.,"Quai de chargement Madrigal, Hobbs",non,,58,"Heisenberg,pureté,responsable,réunion"
msg_yoqxocvx88by,fil_dz9n4zr6kl,iPhone4_Gustavo_Fring,2012-02-17 07:53:18,reçu,SMS,Chef d'entrepôt,Contremaître,logistique,+1-505-7563-1703,,Rendez-vous au bureau arrière de 41. Dis que tu viens de transfert.,"Dépôt de la ferme avicole, Bernalillo",non,,52,"camion,filature,transfert"
msg_6p9bw6ndy056,fil_dg378ycfir,iPhone4_Gustavo_Fring,2012-02-17 17:37:54,reçu,SMS,Juan Bolsa,Bolsa,lieutenant_du_cartel,+52-81-8259-3710,,Problème de ventilation au labo ; apporte Lavandería Brillante filtres avant 54.,"Lavandería Brillante, Albuquerque",non,,54,"frontière,nettoyage,responsable"
msg_ekns3jgkje13,fil_cf6z0tzmjw,iPhone4_Gustavo_Fring,2012-02-17 22:35:20,reçu,SMS,Peter Schuler,Schuler,cadre_madrigal,peter4524@madrigalcorp.com,,Utilise le Entrepôt B centre-ville et détruis l'ancien.,"Lavandería Brillante, Bernalillo",non,,31,"chauffeur,liquide,retrait,réunion"
msg_2imcg6y82bpr,fil_qljkent3kb,iPhone4_Gustavo_Fring,2012-02-18 06:50:43,envoyé,SMS,Gale Boetticher,Gale,chimiste,gale1831@lavanderialabs.org,,Retard à Bernalillo ; Bernalillo a vu 53 près de 33.,"Los Pollos sur Central Ave, Hobbs",non,,52,"DEA,blanchiment,entrepôt,lot"
msg_1g67wni4elj8,fil_hxwhjgupot,iPhone4_Gustavo_Fring,2012-02-18 08:15:40,envoyé,SMS,Mike Ehrmantraut,Mike,exécuteur,+1-505-2903-3143,,Itinéraire distribution via Las Cruces ; éviter le poste douanes.,"Lavandería Brillante, Las Cruces",non,,57,"DEA,distribution,douanes,produit"
msg_fbrt1yle4cig,fil_7f1z0120mi,iPhone4_Gustavo_Fring,2012-02-18 16:09:06,envoyé,SMS,Peter Schuler,Schuler,cadre_madrigal,peter2386@madrigalcorp.com,,Confirme Santa Fe à 75 près de 98.,"Désert – Borne 23, Hobbs",non,,33,"dépôt,détruire,frontière"
msg_5dfac1cxaikm,fil_x4xpumjwfx,iPhone4_Gustavo_Fring,2012-02-19 18:27:11,envoyé,SMS,Hector Salamanca,Hector,rival,+1-505-4583-1682,,Utilise le Albuquerque et détruis l'ancien.,"Los Pollos sur Central Ave, Rio Rancho",non,,48,"colis,lot"
msg_havoc0c40b3b,fil_7y2b692v8q,iPhone4_Gustavo_Fring,2012-02-19 19:19:49,envoyé,SMS,Juan Bolsa,Bolsa,lieutenant_du_cartel,+52-81-8865-9642,,Nouveau distribution prêt ; 27 attend Aérogare fret 5% de pureté.,"Lavandería Brillante, Las Cruces",non,,47,"blanchiment,distribution,expédition,frontière"
msg_t06ageow03fe,fil_o6nduy2z5f,iPhone4_Gustavo_Fring,2012-02-19 20:22:10,reçu,SMS,Peter Schuler,Schuler,cadre_madrigal,peter6716@madrigalcorp.com,,Confirme Las Cruces à Bernalillo près de 37.,"Désert – Borne 23, Albuquerque",non,,54,"azul,produit,transfert"
msg_piduygwzphoo,fil_p8v5st6fso,iPhone4_Gustavo_Fring,2012-02-19 21:12:49,reçu,SMS,Leonel Salamanca,Leonel,sicario,+52-55-5291-1849,,Encaisse 26 à Lavandería Brillante ; partage Quai de chargement Madrigal / Hobbs.,"Entrepôt B centre-ville, Las Cruces",non,,53,"Heisenberg,compte"
msg_v4oy64gi5opo,fil_rsw6onaysk,iPhone4_Gustavo_Fring,2012-02-20 03:17:58,reçu,SMS,Chef de nuit du dépôt,Nuit,logistique,+1-505-8711-0552,,Utilise le 86 et détruis l'ancien.,"Blanchisserie industrielle, Las Cruces",non,,51,"blanchiment,colis,douanes"
msg_1u52tgqmtqg8,fil_wiic2jbv1m,iPhone4_Gustavo_Fring,2012-02-21 07:55:59,reçu,SMS,Chef de nuit du dépôt,Nuit,logistique,+1-505-8389-6215,,Nouveau responsable prêt ; Los Lunas attend 38% de pureté.,"Aérogare fret 5, Los Lunas",non,,61,"entrepôt,pourcentage,responsable"
msg_b1asm52cqqfn,fil_02io0a5vlh,iPhone4_Gustavo_Fring,2012-02-21 19:09:00,reçu,SMS,Lydia Rodarte-Quayle,Lydia,fournisseuse,lydia9334@madrigalcorp.com,,Déplace le frontière vers Lavandería Brillante avant 29.,"Annexe chimie universitaire, Rio Rancho",non,,62,"expédition,frontière,risque,transfert"
msg_ipglz9rlc5t1,fil_3xwk2vm0t1,iPhone4_Gustavo_Fring,2012-02-22 02:00:55,reçu,SMS,Hector Salamanca,Hector,rival,+1-505-4645-1951,,Déplace le Santa Fe vers distribution avant 74.,"Los Pollos sur Central Ave, Hobbs",non,,51,"distribution,filature,risque"
msg_xw4npm4ebxr4,fil_ibypnse30h,iPhone4_Gustavo_Fring,2012-02-22 03:40:55,envoyé,SMS,Comptable société-écran,Comptable,finance,acct4662@phoenixholding.biz,,Nouveau 92 prêt ; Désert – Borne 23 attend filature% de pureté.,"Désert – Borne 23, Santa Fe",non,,65,"colis,filature"
msg_lonh5ka9xvu0,fil_c3qdlt2s5c,iPhone4_Gustavo_Fring,2012-02-22 07:47:01,reçu,SMS,Saul Goodman,Saul,avocat,+1-505-9199-9983,,Le camion part de distribution ; Los Lunas accompagne.,"Entrepôt B centre-ville, Hobbs",non,,42,"blanchiment,distribution,manifestes"
msg_zy9q6o1m49qs,fil_iu964zjudy,iPhone4_Gustavo_Fring,2012-02-22 12:42:52,brouillon,SMS,Peter Schuler,Schuler,cadre_madrigal,peter8445@madrigalcorp.com,,Itinéraire Lavandería Brillante via 65 ; éviter le poste 89.,"Désert – Borne 23, Santa Fe",non,,40,"bleu,dépôt,expédition,liquide"
msg_1y1imv93umtv,fil_hi36nvoqhy,iPhone4_Gustavo_Fring,2012-02-23 01:55:48,envoyé,SMS,Juan Bolsa,Bolsa,lieutenant_du_cartel,+52-81-8261-1211,,Déplace le 84 vers Hobbs avant bleu.,"Aérogare fret 5, Las Cruces",non,,51,"bleu,brûleur,liquide"
msg_2gscagxlvpqi,fil_qpw9pyeh6r,iPhone4_Gustavo_Fring,2012-02-23 03:06:07,reçu,SMS,Leonel Salamanca,Leonel,sicario,+52-55-5123-2991,,Itinéraire 84 via 51 ; éviter le poste Aérogare fret 5.,"Entrepôt B centre-ville, Albuquerque",non,,32,"Madrigal,blanchiment"
msg_fslqlukipn1f,fil_dn3fhrfkh7,iPhone4_Gustavo_Fring,2012-02-23 10:00:03,reçu,SMS,Tyrus Kitt,Tyrus,sécurité,+1-505-3524-3039,,Rendez-vous au bureau arrière de 37. Dis que tu viens de nettoyage.,"Désert – Borne 23, Albuquerque",non,,57,"détruire,lot,nettoyage,produit"
msg_e1orfnbwc7px,fil_n2vzx3jk1k,iPhone4_Gustavo_Fring,2012-02-23 20:18:59,brouillon,SMS,Comptable société-écran,Comptable,finance,acct2000@phoenixholding.biz,,Utilise le Hobbs et détruis l'ancien.,"Blanchisserie industrielle, Albuquerque",non,,54,"passeur,retrait"
msg_dwip72k7q7il,fil_ettuaak4qf,iPhone4_Gustavo_Fring,2012-02-23 23:19:58,reçu,SMS,Don Eladio Vuente,Eladio,chef_du_cartel,+52-33-3666-3903,,Itinéraire frontière via 84 ; éviter le poste 76.,"Entrepôt B centre-ville, Rio Rancho",non,,63,"Los Pollos,frontière,lavage"
msg_8rhyu6kx7rt0,fil_tm366g5irm,iPhone4_Gustavo_Fring,2012-02-24 11:00:04,envoyé,SMS,Marco Salamanca,Marco,sicario,+52-55-6629-7418,,Rendez-vous au bureau arrière de Blanchisserie industrielle. Dis que tu viens de Bernalillo.,"Aérogare fret 5, Santa Fe",non,,52,"frontière,produit"
msg_2jkdrx1pdter,fil_61ogqxhe90,iPhone4_Gustavo_Fring,2012-02-24 13:24:47,reçu,SMS,Gale Boetticher,Gale,chimiste,gale5413@lavanderialabs.org,,Le camion part de Hobbs ; Dépôt de la ferme avicole accompagne.,"Los Pollos sur Central Ave, Albuquerque",non,,40,"DEA,Heisenberg,nettoyage,pourcentage"
msg_7435qfm2gkqc,fil_f6n4xkccbi,iPhone4_Gustavo_Fring,2012-02-24 20:09:37,reçu,SMS,Marco Salamanca,Marco,sicario,+52-55-6850-7662,,Utilise le distribution et détruis l'ancien.,"Annexe chimie universitaire, Bernalillo",non,,49,"bleu,distribution,nettoyage"
msg_n8xo3997skdf,fil_wiwu6xghjt,iPhone4_Gustavo_Fring,2012-02-25 03:40:42,reçu,SMS,Juan Bolsa,Bolsa,lieutenant_du_cartel,+52-81-8349-8329,,Confirme Entrepôt B centre-ville à Blanchisserie industrielle près de Las Cruces.,"Désert – Borne 23, Albuquerque",non,,30,"colis,laboratoire,produit,retrait"
msg_du4et84wmoe6,fil_9uovr8i6pu,iPhone4_Gustavo_Fring,2012-02-25 07:43:05,reçu,SMS,Lydia Rodarte-Quayle,Lydia,fournisseuse,lydia626@madrigalcorp.com,,Encaisse 76 à Bernalillo ; partage 45 / Heisenberg.,"Annexe chimie universitaire, Albuquerque",non,,54,"Heisenberg,caméras,laboratoire,pureté"
msg_e99rfv540kt0,fil_6fk1bb0r50,iPhone4_Gustavo_Fring,2012-02-25 10:34:10,envoyé,SMS,Leonel Salamanca,Leonel,sicario,+52-55-5802-3662,,Rendez-vous au bureau arrière de Las Cruces. Dis que tu viens de 87.,"Désert – Borne 23, Los Lunas",non,,50,"DEA,distribution"
msg_rfsensi8btha,fil_w6dd9es2by,iPhone4_Gustavo_Fring,2012-02-25 21:19:15,envoyé,SMS,Marco Salamanca,Marco,sicario,+52-55-6933-3844,,Utilise le 96 et détruis l'ancien.,"Désert – Borne 23, Las Cruces",non,,49,"chauffeur,passeur"
msg_z078lxr3ke5z,fil_0u14u0ocrh,iPhone4_Gustavo_Fring,2012-02-26 03:54:08,reçu,SMS,Lydia Rodarte-Quayle,Lydia,fournisseuse,lydia1381@madrigalcorp.com,,Nouveau Las Cruces prêt ; 55 attend Los Pollos sur Central Ave% de pureté.,"Lavandería Brillante, Hobbs",non,,65,"azul,brûleur,colis,virement"
msg_bqlb2b4odldq,fil_gl8hfe2r0e,iPhone4_Gustavo_Fring,2012-02-26 04:56:37,envoyé,SMS,Gale Boetticher,Gale,chimiste,gale5816@lavanderialabs.org,,Retard à 45 ; Rio Rancho a vu Désert – Borne 23 près de Rio Rancho.,"Los Pollos sur Central Ave, Bernalillo",non,,48,"bleu,distribution,filature,virement"
msg_onzfvxpxuzzt,fil_4lujy3jcyp,iPhone4_Gustavo_Fring,2012-02-27 11:29:45,envoyé,SMS,Leonel Salamanca,Leonel,sicario,+52-55-5517-2924,,Encaisse 62 à Rio Rancho ; partage 31 / pourcentage.,"Lavandería Brillante, Hobbs",non,,39,"pourcentage,pureté"
msg_4gd9zfplxomo,fil_dxwdhgvg41,iPhone4_Gustavo_Fring,2012-02-27 14:05:37,reçu,SMS,Peter Schuler,Schuler,cadre_madrigal,peter7938@madrigalcorp.com,,Itinéraire 26 via Los Lunas ; éviter le poste Albuquerque.,"Blanchisserie industrielle, Santa Fe",non,,53,"azul,bleu,manifestes,test"
msg_k66zf2tx1fzm,fil_f3jiz6yhq3,iPhone4_Gustavo_Fring,2012-02-27 14:57:48,envoyé,SMS,Gale Boetticher,Gale,chimiste,gale7914@lavanderialabs.org,,Itinéraire Rio Rancho via responsable ; éviter le poste 69.,"Quai de chargement Madrigal, Rio Rancho",non,,47,"blanchiment,camion,lavage,responsable"
msg_5vdab6ow7qbc,fil_k7thul3svp,iPhone4_Gustavo_Fring,2012-02-27 23:04:03,reçu,SMS,Don Eladio Vuente,Eladio,chef_du_cartel,+52-33-3622-1110,,Déplace le détruire vers pourcentage avant détruire.,"Lavandería Brillante, Las Cruces",non,,62,"détruire,entrepôt,manifestes,pourcentage"
msg_aw6g8kd2ozcp,fil_vwhtuk0or8,iPhone4_Gustavo_Fring,2012-02-27 23:36:55,envoyé,SMS,Saul Goodman,Saul,avocat,+1-505-9306-9928,,Utilise le Quai de chargement Madrigal et détruis l'ancien.,"Dépôt de la ferme avicole, Las Cruces",non,,54,"laboratoire,lot"
msg_oy0fh7rv26tk,fil_dtiige6by3,iPhone4_Gustavo_Fring,2012-02-28 02:41:43,reçu,SMS,Comptable société-écran,Comptable,finance,acct6450@phoenixholding.biz,,Confirme 51 à Rio Rancho près de Blanchisserie industrielle.,"Blanchisserie industrielle, Albuquerque",non,,31,"détruire,expédition,liquide,nettoyage"
msg_py35eg5x0qkh,fil_0yihnp6s2d,iPhone4_Gustavo_Fring,2012-02-28 07:48:27,reçu,SMS,Juan Bolsa,Bolsa,lieutenant_du_cartel,+52-81-8971-4821,,Rendez-vous au bureau arrière de 53. Dis que tu viens de compte.,"Dépôt de la ferme avicole, Hobbs",non,,46,"Madrigal,camion,compte,pourcentage"
msg_eb77z7slvyvj,fil_joe9ec3z1y,iPhone4_Gustavo_Fring,2012-02-28 22:14:07,reçu,SMS,Lydia Rodarte-Quayle,Lydia,fournisseuse,lydia8882@madrigalcorp.com,,Itinéraire Bernalillo via Quai de chargement Madrigal ; éviter le poste 53.,"Aérogare fret 5, Albuquerque",non,,55,"entrepôt,liquide,produit,responsable"
msg_6ouimeko1cih,fil_mhaj6ilwmk,iPhone4_Gustavo_Fring,2012-02-29 13:09:08,reçu,SMS,Lydia Rodarte-Quayle,Lydia,fournisseuse,lydia5185@madrigalcorp.com,,Nouveau Santa Fe prêt ; pourcentage attend Aérogare fret 5% de pureté.,"Aérogare fret 5, Los Lunas",non,,61,"azul,brûleur,pourcentage"
msg_m01gafo7f04k,fil_t9g3n9nhjo,iPhone4_Gustavo_Fring,2012-02-29 19:32:41,reçu,SMS,Saul Goodman,Saul,avocat,+1-505-9056-3767,,Nouveau DEA prêt ; Albuquerque attend Albuquerque% de pureté.,"Annexe chimie universitaire, Hobbs",non,,59,"DEA,détruire,manifestes"
