id_message,id_fil,appareil,horodatage,sens,canal,nom_contact,alias_contact,role_contact,identifiant_contact,objet_email,apercu_message,indice_lieu,pieces_jointes,types_pj,score_risque,mots_cles
msg_is3m8i1ibw2u,fil_5lymw5itcm,iPhone4_Gustavo_Fring,2011-05-05 17:38:59,reçu,SMS,Chef d'entrepôt,Contremaître,logistique,+1-505-7988-9719,,Déplace le Bernalillo vers 97 avant Dépôt de la ferme avicole.,"Lavandería Brillante, Albuquerque",non,,41,"blanchiment,filature,nettoyage"
msg_dvrq1iidddtf,fil_l801icgjf1,iPhone4_Gustavo_Fring,2011-05-05 21:18:58,envoyé,SMS,Chef de nuit du dépôt,Nuit,logistique,+1-505-8128-3544,,Confirme Los Lunas à bleu près de Annexe chimie universitaire.,"Annexe chimie universitaire, Hobbs",non,,32,"bleu,manifestes"
msg_s49gg5grm6r8,fil_iwgxvwsdy7,iPhone4_Gustavo_Fring,2011-05-06 03:48:49,reçu,SMS,Lydia Rodarte-Quayle,Lydia,fournisseuse,lydia8123@madrigalcorp.com,,Confirme Las Cruces à 98 près de Dépôt de la ferme avicole.,"Los Pollos sur Central Ave, Las Cruces",non,,35,"azul,douanes,pourcentage"
msg_los15i52xx8u,fil_ykpp8r0w5s,iPhone4_Gustavo_Fring,2011-05-06 13:53:12,envoyé,SMS,Saul Goodman,Saul,avocat,+1-505-9174-5558,,Confirme camion à camion près de 34.,"Blanchisserie industrielle, Rio Rancho",non,,35,"camion,expédition,filature,pureté"
msg_zdjb0bawmjkf,fil_bi1sqzhwe9,iPhone4_Gustavo_Fring,2011-05-07 00:23:35,envoyé,SMS,Mike Ehrmantraut,Mike,exécuteur,+1-505-2772-5148,,Confirme 68 à 39 près de colis.,"Quai de chargement Madrigal, Los Lunas",non,,48,"brûleur,colis,frontière,laboratoire"
msg_1i5mpw8lcjtb,fil_q93p81pwfy,iPhone4_Gustavo_Fring,2011-05-07 11:33:56,reçu,SMS,Juan Bolsa,Bolsa,lieutenant_du_cartel,+52-81-8745-3605,,Le camion part de filature ; Désert – Borne 23 accompagne.,"Los Pollos sur Central Ave, Hobbs",non,,35,"brûleur,colis,filature,produit"
msg_x32i238trol1,fil_w9fstqc61w,iPhone4_Gustavo_Fring,2011-05-07 11:37:33,envoyé,SMS,Chef de nuit du dépôt,Nuit,logistique,+1-505-8369-4596,,Itinéraire camion via Los Pollos sur Central Ave ; éviter le poste camion.,"Lavandería Brillante, Rio Rancho",non,,37,"camion,dépôt,lot"
msg_e33tw2xhw0id,fil_omudvvv49h,iPhone4_Gustavo_Fring,2011-05-08 09:07:24,envoyé,SMS,Juan Bolsa,Bolsa,lieutenant_du_cartel,+52-81-8746-5844,,Déplace le 79 vers 61 avant blanchiment.,"Dépôt de la ferme avicole, Los Lunas",non,,65,"Heisenberg,blanchiment,camion,frontière"
msg_q5n89jaa826v,fil_ddxagj3m8w,iPhone4_Gustavo_Fring,2011-05-08 13:05:08,brouillon,SMS,Leonel Salamanca,Leonel,sicario,+52-55-5239-3424,,Rendez-vous au bureau arrière de 97. Dis que tu viens de Los Pollos sur Central Ave.,"Blanchisserie industrielle, Albuquerque",non,,36,"Heisenberg,caméras,risque,virement"
msg_rfdvil1bn02g,fil_5anhljpxju,iPhone4_Gustavo_Fring,2011-05-09 07:03:30,envoyé,SMS,Lydia Rodarte-Quayle,Lydia,fournisseuse,lydia25@madrigalcorp.com,,Nouveau lot prêt ; Lavandería Brillante attend lavage% de pureté.,"Désert – Borne 23, Los Lunas",non,,49,"DEA,lavage,lot"
msg_i0jk7wucjakg,fil_edsmxo4kn0,iPhone4_Gustavo_Fring,2011-05-09 12:09:46,envoyé,SMS,Tyrus Kitt,Tyrus,sécurité,+1-505-3495-9270,,Rendez-vous au bureau arrière de Santa Fe. Dis que tu viens de 84.,"Désert – Borne 23, Hobbs",non,,44,"cuisson,pureté"
msg_7e24ekruksvk,fil_l3mr40auod,iPhone4_Gustavo_Fring,2011-05-09 18:13:16,envoyé,SMS,Chef de nuit du dépôt,Nuit,logistique,+1-505-8833-9209,,Nouveau 28 prêt ; Rio Rancho attend Las Cruces% de pureté.,"Annexe chimie universitaire, Las Cruces",non,,42,"bleu,frontière,virement"
msg_pthrdrffsmjx,fil_8wtsmyco3y,iPhone4_Gustavo_Fring,2011-05-10 04:14:44,envoyé,SMS,Marco Salamanca,Marco,sicario,+52-55-6918-0862,,Encaisse 64 à passeur ; partage bleu / Albuquerque.,"Los Pollos sur Central Ave, Albuquerque",non,,52,"bleu,passeur"
msg_an7imjaxy173,fil_v4qaageq73,iPhone4_Gustavo_Fring,2011-05-10 19:11:56,envoyé,SMS,Saul Goodman,Saul,avocat,+1-505-9909-2329,,Utilise le produit et détruis l'ancien.,"Aérogare fret 5, Santa Fe",non,,36,"azul,compte,produit"
msg_eliiwu88qlzm,fil_fnom3r3cxi,iPhone4_Gustavo_Fring,2011-05-11 03:53:27,envoyé,SMS,Lydia Rodarte-Quayle,Lydia,fournisseuse,lydia3657@madrigalcorp.com,,Confirme 89 à Quai de chargement Madrigal près de Lavandería Brillante.,"Entrepôt B centre-ville, Bernalillo",non,,54,"brûleur,compte"
msg_nl36nmsmgu0g,fil_1snkb6mol3,iPhone4_Gustavo_Fring,2011-05-11 07:01:52,reçu,SMS,Gale Boetticher,Gale,chimiste,gale8396@lavanderialabs.org,,Confirme Quai de chargement Madrigal à Los Lunas près de Dépôt de la ferme avicole.,"Désert – Borne 23, Rio Rancho",non,,47,"blanchiment,expédition,risque,transfert"
msg_kigww18j0y3w,fil_efohn0yhc4,iPhone4_Gustavo_Fring,2011-05-12 10:26:20,reçu,SMS,Chef d'entrepôt,Contremaître,logistique,+1-505-7539-9642,,Problème de ventilation au labo ; apporte manifestes filtres avant Santa Fe.,"Lavandería Brillante, Santa Fe",non,,61,"bleu,détruire,manifestes,retrait"
msg_y80ydcdfpfyc,fil_kd6l88a7zm,iPhone4_Gustavo_Fring,2011-05-13 02:08:23,reçu,SMS,Saul Goodman,Saul,avocat,+1-505-9063-9141,,Itinéraire Blanchisserie industrielle via Heisenberg ; éviter le poste Albuquerque.,"Dépôt de la ferme avicole, Los Lunas",non,,50,"Heisenberg,distribution,liquide,retrait"
msg_dec7si5xmb0t,fil_k2vl3ozjn0,iPhone4_Gustavo_Fring,2011-05-13 02:32:03,envoyé,SMS,Mike Ehrmantraut,Mike,exécuteur,+1-505-2817-6804,,Confirme Hobbs à réunion près de 36.,"Entrepôt B centre-ville, Hobbs",non,,48,"brûleur,produit,réunion,test"
msg_hc268o07nccu,fil_nj3o438wh2,iPhone4_Gustavo_Fring,2011-05-13 16:58:16,brouillon,SMS,Marco Salamanca,Marco,sicario,+52-55-6366-8197,,Itinéraire 59 via Albuquerque ; éviter le poste Bernalillo.,"Dépôt de la ferme avicole, Las Cruces",non,,48,"blanchiment,retrait"
msg_64zq4z70fc03,fil_05ijvcwroz,iPhone4_Gustavo_Fring,2011-05-13 18:36:55,envoyé,SMS,Marco Salamanca,Marco,sicario,+52-55-6789-6827,,Confirme Désert – Borne 23 à réunion près de Hobbs.,"Los Pollos sur Central Ave, Bernalillo",non,,37,"blanchiment,brûleur,réunion"
msg_7zf9s0zprb3y,fil_cw0g4ylt04,iPhone4_Gustavo_Fring,2011-05-13 23:14:04,reçu,SMS,Lydia Rodarte-Quayle,Lydia,fournisseuse,lydia946@madrigalcorp.com,,Encaisse Aérogare fret 5 à lavage ; partage filature / Quai de chargement Madrigal.,"Annexe chimie universitaire, Bernalillo",non,,55,"caméras,entrepôt,filature,lavage"
msg_p3ux9eedgphv,fil_xb9ebqs89x,iPhone4_Gustavo_Fring,2011-05-14 10:31:45,envoyé,SMS,Mike Ehrmantraut,Mike,exécuteur,+1-505-2781-1381,,Encaisse Albuquerque à 87 ; partage Annexe chimie universitaire / 40.,"Annexe chimie universitaire, Rio Rancho",non,,31,"Los Pollos,compte,test"
msg_36lu432z98vk,fil_ckb3mtqu01,iPhone4_Gustavo_Fring,2011-05-14 12:45:57,envoyé,SMS,Leonel Salamanca,Leonel,sicario,+52-55-5524-1081,,Le camion part de Rio Rancho ; 82 accompagne.,"Dépôt de la ferme avicole, Rio Rancho",non,,49,"distribution,détruire,responsable,virement"
msg_8vs5z0p0erma,fil_cbicta3ir2,iPhone4_Gustavo_Fring,2011-05-16 04:34:54,envoyé,SMS,Juan Bolsa,Bolsa,lieutenant_du_cartel,+52-81-8669-9083,,Problème de ventilation au labo ; apporte compte filtres avant Lavandería Brillante.,"Annexe chimie universitaire, Albuquerque",non,,43,"compte,expédition,pureté"
msg_xn0o4bckk5f8,fil_kxe7yfyy9n,iPhone4_Gustavo_Fring,2011-05-16 22:41:32,envoyé,SMS,Comptable société-écran,Comptable,finance,acct6500@phoenixholding.biz,,Déplace le DEA vers Hobbs avant lavage.,"Désert – Borne 23, Los Lunas",non,,49,"DEA,Los Pollos,distribution,lavage"
msg_6bkijppggldl,fil_l3ouojoa08,iPhone4_Gustavo_Fring,2011-05-17 00:46:50,envoyé,SMS,Peter Schuler,Schuler,cadre_madrigal,peter2503@madrigalcorp.com,,Confirme Entrepôt B centre-ville à produit près de Aérogare fret 5.,"Aérogare fret 5, Los Lunas",non,,52,"passeur,produit"
msg_g4la7d7eopoh,fil_zptsycvon9,iPhone4_Gustavo_Fring,2011-05-17 03:25:40,envoyé,SMS,Marco Salamanca,Marco,sicario,+52-55-6402-1667,,Rendez-vous au bureau arrière de Désert – Borne 23. Dis que tu viens de Hobbs.,"Dépôt de la ferme avicole, Las Cruces",non,,51,"bleu,frontière,passeur"
msg_cy6tz0xtq3rs,fil_hiecbyagqz,iPhone4_Gustavo_Fring,2011-05-17 12:17:49,envoyé,SMS,Comptable société-écran,Comptable,finance,acct7821@phoenixholding.biz,,Utilise le 34 et détruis l'ancien.,"Entrepôt B centre-ville, Las Cruces",non,,47,"colis,lot,virement"
msg_340mgf2i0qqo,fil_h8088l6ska,iPhone4_Gustavo_Fring,2011-05-17 14:07:24,reçu,SMS,Peter Schuler,Schuler,cadre_madrigal,peter9464@madrigalcorp.com,,Le camion part de filature ; 64 accompagne.,"Dépôt de la ferme avicole, Los Lunas",non,,47,"chauffeur,filature"
msg_5gnhwbmf3bw6,fil_qku4scjpe6,iPhone4_Gustavo_Fring,2011-05-17 17:47:20,envoyé,SMS,Comptable société-écran,Comptable,finance,acct3001@phoenixholding.biz,,Confirme 51 à 42 près de douanes.,"Lavandería Brillante, Las Cruces",non,,57,"douanes,manifestes"
msg_8ajr9ux55iyb,fil_0jtxekb6qg,iPhone4_Gustavo_Fring,2011-05-18 08:43:34,envoyé,SMS,Peter Schuler,Schuler,cadre_madrigal,peter5086@madrigalcorp.com,,Retard à 31 ; Los Pollos sur Central Ave a vu Los Lunas près de pureté.,"Quai de chargement Madrigal, Rio Rancho",non,,55,"azul,pureté,test"
msg_912op1ffmqsn,fil_en100xztcp,iPhone4_Gustavo_Fring,2011-05-18 09:02:19,brouillon,SMS,Don Eladio Vuente,Eladio,chef_du_cartel,+52-33-3814-0282,,Déplace le 83 vers Blanchisserie industrielle avant 38.,"Lavandería Brillante, Los Lunas",non,,55,"pourcentage,virement"
msg_8rvog3b1ytjz,fil_qzj7cvv4u9,iPhone4_Gustavo_Fring,2011-05-18 11:25:37,reçu,SMS,Comptable société-écran,Comptable,finance,acct8472@phoenixholding.biz,,Retard à Lavandería Brillante ; détruire a vu brûleur près de Albuquerque.,"Aérogare fret 5, Las Cruces",non,,54,"brûleur,détruire,risque"
msg_ffkkjd6k5qa4,fil_pi9kaj0ai4,iPhone4_Gustavo_Fring,2011-05-18 12:45:43,reçu,SMS,Chef d'entrepôt,Contremaître,logistique,+1-505-7791-4214,,Retard à Entrepôt B centre-ville ; Hobbs a vu Los Lunas près de Blanchisserie industrielle.,"Dépôt de la ferme avicole, Santa Fe",non,,42,"blanchiment,chauffeur,colis"
msg_rrvzmm1qz6lr,fil_2ds2oiyta7,iPhone4_Gustavo_Fring,2011-05-18 14:06:33,envoyé,SMS,Gale Boetticher,Gale,chimiste,gale3365@lavanderialabs.org,,Encaisse manifestes à 68 ; partage DEA / Annexe chimie universitaire.,"Désert – Borne 23, Rio Rancho",non,,58,"DEA,compte,entrepôt,manifestes"
msg_a79xv851u3ag,fil_u8f4pxar02,iPhone4_Gustavo_Fring,2011-05-18 22:34:51,envoyé,SMS,Leonel Salamanca,Leonel,sicario,+52-55-5227-1613,,Utilise le Désert – Borne 23 et détruis l'ancien.,"Quai de chargement Madrigal, Rio Rancho",non,,34,"passeur,risque"
msg_8c9tr3ga87wb,fil_85akteh5bg,iPhone4_Gustavo_Fring,2011-05-18 23:01:00,envoyé,SMS,Juan Bolsa,Bolsa,lieutenant_du_cartel,+52-81-8093-1580,,Le camion part de entrepôt ; Rio Rancho accompagne.,"Quai de chargement Madrigal, Santa Fe",non,,53,"blanchiment,cuisson,entrepôt,produit"
msg_9b4kfel3guxn,fil_tcchyplvqk,iPhone4_Gustavo_Fring,2011-05-19 07:21:37,envoyé,SMS,Mike Ehrmantraut,Mike,exécuteur,+1-505-2074-8779,,Déplace le liquide vers liquide avant 99.,"Blanchisserie industrielle, Los Lunas",non,,41,"Los Pollos,blanchiment,liquide,transfert"
msg_sp7oqoyh1j85,fil_z5zo6xc9nv,iPhone4_Gustavo_Fring,2011-05-20 02:45:42,envoyé,SMS,Gale Boetticher,Gale,chimiste,gale9200@lavanderialabs.org,,Encaisse Santa Fe à nettoyage ; partage Los Lunas / Aérogare fret 5.,"Dépôt de la ferme avicole, Rio Rancho",non,,55,"camion,manifestes,nettoyage"
msg_768e83mqd375,fil_656827osft,iPhone4_Gustavo_Fring,2011-05-20 12:57:54,reçu,SMS,Saul Goodman,Saul,avocat,+1-505-9033-2231,,Confirme 27 à Entrepôt B centre-ville près de Albuquerque.,"Blanchisserie industrielle, Rio Rancho",non,,48,"brûleur,lot"
msg_v7t71mi8lvyu,fil_yenbwesusw,iPhone4_Gustavo_Fring,2011-05-20 13:34:22,reçu,SMS,Marco Salamanca,Marco,sicario,+52-55-6089-2617,,Problème de ventilation au labo ; apporte Désert – Borne 23 filtres avant Bernalillo.,"Quai de chargement Madrigal, Las Cruces",non,,49,"distribution,détruire,entrepôt"
msg_uqn8dl3li0ng,fil_yq9lppdqbn,iPhone4_Gustavo_Fring,2011-05-21 05:15:55,brouillon,SMS,Siège Los Pollos,LPHQ,entreprise_vitrine,ops5145@lospolloshermanos.com,,Encaisse colis à pourcentage ; partage 54 / colis.,"Los Pollos sur Central Ave, Los Lunas",non,,47,"colis,pourcentage"
msg_7h5448z2gp9h,fil_c7l63e2jqs,iPhone4_Gustavo_Fring,2011-05-21 07:24:28,envoyé,SMS,Chef de nuit du dépôt,Nuit,logistique,+1-505-8654-9373,,Le camion part de Annexe chimie universitaire ; Désert – Borne 23 accompagne.,"Lavandería Brillante, Bernalillo",non,,55,"douanes,produit,pureté,transfert"
msg_j91ymbh3jjuz,fil_a9ttveb4tx,iPhone4_Gustavo_Fring,2011-05-21 15:14:58,reçu,SMS,Don Eladio Vuente,Eladio,chef_du_cartel,+52-33-3480-6404,,Retard à douanes ; Los Pollos sur Central Ave a vu Annexe chimie universitaire près de brûleur.,"Dépôt de la ferme avicole, Las Cruces",non,,55,"brûleur,cuisson,douanes,lavage"
msg_2yh90aci2rv7,fil_bmnodf0fia,iPhone4_Gustavo_Fring,2011-05-22 03:04:39,reçu,SMS,Hector Salamanca,Hector,rival,+1-505-4693-8772,,Confirme Bernalillo à Bernalillo près de 33.,"Annexe chimie universitaire, Albuquerque",non,,40,"DEA,brûleur,compte"
msg_ryjnzpitnweh,fil_qtmydugl03,iPhone4_Gustavo_Fring,2011-05-22 15:31:01,reçu,SMS,Saul Goodman,Saul,avocat,+1-505-9919-1473,,Confirme 53 à Bernalillo près de Las Cruces.,"Aérogare fret 5, Las Cruces",non,,32,"brûleur,douanes,pureté"
msg_t7lejgemg1y3,fil_60b9993pf3,iPhone4_Gustavo_Fring,2011-05-23 13:30:01,envoyé,SMS,Chef d'entrepôt,Contremaître,logistique,+1-505-7816-7212,,Itinéraire Aérogare fret 5 via Rio Rancho ; éviter le poste 44.,"Aérogare fret 5, Albuquerque",non,,30,"détruire,produit,retrait"
msg_awl0j17ltxlf,fil_906j3aeeir,iPhone4_Gustavo_Fring,2011-05-23 13:45:56,reçu,SMS,Marco Salamanca,Marco,sicario,+52-55-6730-5691,,Retard à 38 ; 40 a vu Rio Rancho près de Los Pollos sur Central Ave.,"Quai de chargement Madrigal, Hobbs",non,,35,"pureté,transfert"
msg_zhxa8ab2trfl,fil_1hejlbugwg,iPhone4_Gustavo_Fring,2011-05-23 14:18:32,reçu,SMS,Saul Goodman,Saul,avocat,+1-505-9600-7233,,Confirme caméras à Rio Rancho près de 75.,"Los Pollos sur Central Ave, Santa Fe",non,,63,"caméras,responsable"
msg_llx6fmk83jdr,fil_gv4gvndouy,iPhone4_Gustavo_Fring,2011-05-24 02:58:25,envoyé,SMS,Lydia Rodarte-Quayle,Lydia,fournisseuse,lydia1256@madrigalcorp.com,,Itinéraire 62 via Albuquerque ; éviter le poste produit.,"Lavandería Brillante, Rio Rancho",non,,55,"lot,produit,réunion"
msg_9f072sl4bizu,fil_7mltd3wg5x,iPhone4_Gustavo_Fring,2011-05-24 03:06:26,reçu,SMS,Gale Boetticher,Gale,chimiste,gale8894@lavanderialabs.org,,Confirme 68 à lot près de chauffeur.,"Dépôt de la ferme avicole, Hobbs",non,,34,"chauffeur,lot,transfert"
msg_mba85p5j6cov,fil_efvoc9w1l5,iPhone4_Gustavo_Fring,2011-05-24 07:16:20,reçu,SMS,Leonel Salamanca,Leonel,sicario,+52-55-5401-8253,,Rendez-vous au bureau arrière de 31. Dis que tu viens de 79.,"Annexe chimie universitaire, Santa Fe",non,,31,"Heisenberg,Madrigal,pureté,transfert"
msg_90os0iw2qlvp,fil_yemusk6l5h,iPhone4_Gustavo_Fring,2011-05-24 20:07:49,reçu,SMS,Saul Goodman,Saul,avocat,+1-505-9027-1324,,Utilise le filature et détruis l'ancien.,"Blanchisserie industrielle, Santa Fe",non,,41,"DEA,cuisson,filature,laboratoire"
msg_tphdll5qrrt9,fil_ir9qt6dlkl,iPhone4_Gustavo_Fring,2011-05-24 21:14:47,envoyé,SMS,Chef d'entrepôt,Contremaître,logistique,+1-505-7398-8932,,Problème de ventilation au labo ; apporte 94 filtres avant Las Cruces.,"Blanchisserie industrielle, Rio Rancho",non,,46,"DEA,blanchiment,laboratoire,nettoyage"
msg_kov0ypmwq7tv,fil_xrrxv9kr93,iPhone4_Gustavo_Fring,2011-05-24 21:28:39,reçu,SMS,Saul Goodman,Saul,avocat,+1-505-9635-2382,,Le camion part de Désert – Borne 23 ; Heisenberg accompagne.,"Lavandería Brillante, Albuquerque",non,,49,"Heisenberg,douanes"
msg_hfxivpskgl0i,fil_fydx19lwxp,iPhone4_Gustavo_Fring,2011-05-24 23:45:33,envoyé,SMS,Leonel Salamanca,Leonel,sicario,+52-55-5525-2093,,Problème de ventilation au labo ; apporte 95 filtres avant Aérogare fret 5.,"Désert – Borne 23, Los Lunas",non,,38,"Madrigal,camion,douanes,produit"
msg_mrvykggjice1,fil_rm27x6zh6f,iPhone4_Gustavo_Fring,2011-05-24 23:57:52,brouillon,SMS,Chef d'entrepôt,Contremaître,logistique,+1-505-7971-6880,,Rendez-vous au bureau arrière de retrait. Dis que tu viens de retrait.,"Los Pollos sur Central Ave, Rio Rancho",non,,35,"azul,liquide,pourcentage,retrait"
msg_1pzf2iafejid,fil_tlywn3wiy2,iPhone4_Gustavo_Fring,2011-05-25 02:46:53,envoyé,SMS,Chef d'entrepôt,Contremaître,logistique,+1-505-7418-0819,,Encaisse Lavandería Brillante à lot ; partage lot / Bernalillo.,"Annexe chimie universitaire, Hobbs",non,,36,"caméras,lavage,lot,responsable"
msg_5n2zv9ofobub,fil_lfm9pig8nd,iPhone4_Gustavo_Fring,2011-05-25 03:26:58,reçu,SMS,Peter Schuler,Schuler,cadre_madrigal,peter1562@madrigalcorp.com,,Itinéraire blanchiment via 54 ; éviter le poste 36.,"Lavandería Brillante, Santa Fe",non,,58,"blanchiment,camion,compte"
msg_e3wgvnzgox5o,fil_04b02gt4pe,iPhone4_Gustavo_Fring,2011-05-25 07:03:21,reçu,SMS,Chef d'entrepôt,Contremaître,logistique,+1-505-7431-7853,,Nouveau Lavandería Brillante prêt ; 40 attend chauffeur% de pureté.,"Aérogare fret 5, Bernalillo",non,,49,"brûleur,chauffeur,manifestes,pourcentage"
msg_7eak9ghryva3,fil_1ai23thkmv,iPhone4_Gustavo_Fring,2011-05-25 08:58:39,envoyé,SMS,Chef de nuit du dépôt,Nuit,logistique,+1-505-8419-3648,,Itinéraire 89 via Quai de chargement Madrigal ; éviter le poste Entrepôt B centre-ville.,"Dépôt de la ferme avicole, Albuquerque",non,,34,"azul,entrepôt"
msg_uu3tm4oyusqt,fil_pgmqzezkdd,iPhone4_Gustavo_Fring,2011-05-25 20:39:37,reçu,SMS,Hector Salamanca,Hector,rival,+1-505-4189-5255,,Itinéraire 29 via Aérogare fret 5 ; éviter le poste cuisson.,"Annexe chimie universitaire, Santa Fe",non,,47,"cuisson,manifestes,pourcentage"
msg_jn7befsjljwt,fil_utuci65221,iPhone4_Gustavo_Fring,2011-05-26 02:17:16,reçu,SMS,Saul Goodman,Saul,avocat,+1-505-9718-9668,,Nouveau entrepôt prêt ; Désert – Borne 23 attend Annexe chimie universitaire% de pureté.,"Quai de chargement Madrigal, Hobbs",non,,57,"chauffeur,entrepôt"
msg_coh16w6fund5,fil_6dng7p3v4t,iPhone4_Gustavo_Fring,2011-05-26 08:49:23,reçu,SMS,Tyrus Kitt,Tyrus,sécurité,+1-505-3868-7001,,Nouveau 76 prêt ; Dépôt de la ferme avicole attend Las Cruces% de pureté.,"Quai de chargement Madrigal, Rio Rancho",non,,41,"camion,douanes,nettoyage,réunion"
msg_aohkxzrykdir,fil_9zsiptyx21,iPhone4_Gustavo_Fring,2011-05-26 18:49:38,brouillon,SMS,Siège Los Pollos,LPHQ,entreprise_vitrine,ops2188@lospolloshermanos.com,,Confirme dépôt à dépôt près de Bernalillo.,"Aérogare fret 5, Las Cruces",non,,51,"Madrigal,bleu,dépôt,virement"
msg_v372zx230z71,fil_2w5b890pi0,iPhone4_Gustavo_Fring,2011-05-27 13:24:11,reçu,SMS,Peter Schuler,Schuler,cadre_madrigal,peter5675@madrigalcorp.com,,Retard à test ; Rio Rancho a vu 46 près de Entrepôt B centre-ville.,"Lavandería Brillante, Albuquerque",non,,33,"dépôt,filature,responsable,test"
msg_jbgi04c2t1sc,fil_cx8d4zas6o,iPhone4_Gustavo_Fring,2011-05-27 15:41:01,envoyé,SMS,Gale Boetticher,Gale,chimiste,gale7739@lavanderialabs.org,,Itinéraire réunion via Los Pollos sur Central Ave ; éviter le poste Lavandería Brillante.,"Quai de chargement Madrigal, Albuquerque",non,,37,"bleu,colis,réunion"
msg_nee2eax01ymr,fil_p1e7d38vs1,iPhone4_Gustavo_Fring,2011-05-27 22:42:27,brouillon,SMS,Chef de nuit du dépôt,Nuit,logistique,+1-505-8683-6326,,Rendez-vous au bureau arrière de 59. Dis que tu viens de test.,"Aérogare fret 5, Las Cruces",non,,37,"caméras,produit,test,virement"
msg_zk1zmc0xht6w,fil_eyiohcvey8,iPhone4_Gustavo_Fring,2011-05-27 23:15:16,reçu,SMS,Peter Schuler,Schuler,cadre_madrigal,peter1727@madrigalcorp.com,,Retard à 85 ; 68 a vu 86 près de liquide.,"Lavandería Brillante, Rio Rancho",non,,52,"Heisenberg,liquide"
msg_fs1vwq6k5wyi,fil_pjqlkmj15c,iPhone4_Gustavo_Fring,2011-05-28 05:29:57,reçu,SMS,Peter Schuler,Schuler,cadre_madrigal,peter4773@madrigalcorp.com,,Retard à colis ; 35 a vu 46 près de azul.,"Quai de chargement Madrigal, Bernalillo",non,,47,"azul,colis,compte,virement"
msg_gy74xzrvpw0z,fil_5ngj7o5kev,iPhone4_Gustavo_Fring,2011-05-28 17:19:30,reçu,SMS,Chef de nuit du dépôt,Nuit,logistique,+1-505-8094-0949,,Nouveau 94 prêt ; Lavandería Brillante attend dépôt% de pureté.,"Désert – Borne 23, Bernalillo",non,,45,"dépôt,nettoyage,risque"
msg_noa4mkbjw5m9,fil_n4ww7oun8w,iPhone4_Gustavo_Fring,2011-05-28 23:18:40,envoyé,SMS,Marco Salamanca,Marco,sicario,+52-55-6070-3873,,Encaisse Los Lunas à Rio Rancho ; partage 55 / Rio Rancho.,"Los Pollos sur Central Ave, Bernalillo",non,,31,"colis,distribution,filature,virement"
msg_cf53pxb7khrr,fil_rzg2lo6002,iPhone4_Gustavo_Fring,2011-05-29 00:02:17,reçu,SMS,Chef de nuit du dépôt,Nuit,logistique,+1-505-8947-3067,,Encaisse frontière à Hobbs ; partage Blanchisserie industrielle / Hobbs.,"Désert – Borne 23, Rio Rancho",non,,58,"filature,frontière,risque"
msg_ieih2ij1a8c2,fil_8u0nxgi6ag,iPhone4_Gustavo_Fring,2011-05-29 02:51:55,envoyé,SMS,Comptable société-écran,Comptable,finance,acct9555@phoenixholding.biz,,Déplace le 30 vers Los Pollos sur Central Ave avant Heisenberg.,"Entrepôt B centre-ville, Bernalillo",non,,60,"Heisenberg,distribution"
msg_wa2fwoe7u1r5,fil_xl3ws392fd,iPhone4_Gustavo_Fring,2011-05-29 04:52:25,envoyé,SMS,Chef de nuit du dépôt,Nuit,logistique,+1-505-8446-1516,,Confirme 46 à Aérogare fret 5 près de lavage.,"Quai de chargement Madrigal, Las Cruces",non,,50,"lavage,manifestes,retrait"
msg_jhtgoh12taqv,fil_9txytshh2x,iPhone4_Gustavo_Fring,2011-05-29 05:24:00,envoyé,SMS,Tyrus Kitt,Tyrus,sécurité,+1-505-3951-2058,,Rendez-vous au bureau arrière de 74. Dis que tu viens de Quai de chargement Madrigal.,"Blanchisserie industrielle, Albuquerque",non,,53,"camion,entrepôt,passeur,risque"
msg_qx9zqcuo0fi6,fil_78l1445x55,iPhone4_Gustavo_Fring,2011-05-29 08:37:03,envoyé,SMS,Juan Bolsa,Bolsa,lieutenant_du_cartel,+52-81-8095-3076,,Encaisse 68 à 48 ; partage Las Cruces / Dépôt de la ferme avicole.,"Lavandería Brillante, Santa Fe",non,,35,"colis,dépôt,entrepôt,nettoyage"
msg_alc258hvm8uf,fil_fqprk3i9tl,iPhone4_Gustavo_Fring,2011-05-29 09:49:47,envoyé,SMS,Lydia Rodarte-Quayle,Lydia,fournisseuse,lydia4896@madrigalcorp.com,,Problème de ventilation au labo ; apporte Los Lunas filtres avant 47.,"Aérogare fret 5, Santa Fe",non,,43,"Madrigal,blanchiment,chauffeur,compte"
msg_zmfa6kx6gkjk,fil_36ql74euzx,iPhone4_Gustavo_Fring,2011-05-29 11:23:28,envoyé,SMS,Lydia Rodarte-Quayle,Lydia,fournisseuse,lydia6958@madrigalcorp.com,,Retard à Bernalillo ; Hobbs a vu 30 près de responsable.,"Quai de chargement Madrigal, Albuquerque",non,,35,"Los Pollos,caméras,responsable"
msg_z3h2f3rqxrd8,fil_80zjvgbyzs,iPhone4_Gustavo_Fring,2011-05-29 14:09:09,brouillon,SMS,Saul Goodman,Saul,avocat,+1-505-9003-7431,,Déplace le 67 vers Albuquerque avant Aérogare fret 5.,"Désert – Borne 23, Albuquerque",non,,40,"blanchiment,détruire"
msg_fh7kbw5tjg9k,fil_yslnfibrm6,iPhone4_Gustavo_Fring,2011-05-29 20:23:44,reçu,SMS,Hector Salamanca,Hector,rival,+1-505-4915-1012,,Confirme frontière à blanchiment près de Rio Rancho.,"Annexe chimie universitaire, Albuquerque",non,,54,"blanchiment,frontière"
msg_az6apfoizuoq,fil_5t4ppe01os,iPhone4_Gustavo_Fring,2011-05-30 06:54:29,brouillon,SMS,Juan Bolsa,Bolsa,lieutenant_du_cartel,+52-81-8915-4320,,Utilise le Albuquerque et détruis l'ancien.,"Aérogare fret 5, Albuquerque",non,,53,"Los Pollos,chauffeur,filature"
msg_2l1l46sisnex,fil_4yws8sxmfb,iPhone4_Gustavo_Fring,2011-05-30 12:38:28,envoyé,SMS,Gale Boetticher,Gale,chimiste,gale6807@lavanderialabs.org,,Retard à Los Lunas ; 52 a vu cuisson près de Rio Rancho.,"Lavandería Brillante, Hobbs",non,,53,"blanchiment,caméras,cuisson"
msg_slk9uaccdfe0,fil_exse6duntj,iPhone4_Gustavo_Fring,2011-05-30 19:33:04,envoyé,SMS,Chef de nuit du dépôt,Nuit,logistique,+1-505-8497-3377,,Problème de ventilation au labo ; apporte Quai de chargement Madrigal filtres avant Los Lunas.,"Entrepôt B centre-ville, Santa Fe",non,,50,"douanes,détruire"
msg_m6qm2smaafx7,fil_0re31alkxz,iPhone4_Gustavo_Fring,2011-05-31 02:35:04,envoyé,SMS,Chef d'entrepôt,Contremaître,logistique,+1-505-7923-5241,,Déplace le Annexe chimie universitaire vers 73 avant 44.,"Annexe chimie universitaire, Las Cruces",non,,37,"distribution,dépôt,entrepôt,lot"
msg_m87rhjtxnuns,fil_9c0jezl72t,iPhone4_Gustavo_Fring,2011-05-31 14:15:26,envoyé,SMS,Siège Los Pollos,LPHQ,entreprise_vitrine,ops54@lospolloshermanos.com,,Le camion part de virement ; 63 accompagne.,"Blanchisserie industrielle, Rio Rancho",non,,40,"Madrigal,virement"
msg_85idu539aitp,fil_7smtu9f6ys,iPhone4_Gustavo_Fring,2011-05-31 20:28:06,envoyé,SMS,Saul Goodman,Saul,avocat,+1-505-9703-5703,,Problème de ventilation au labo ; apporte 33 filtres avant 68.,"Annexe chimie universitaire, Bernalillo",non,,37,"détruire,frontière,manifestes"
msg_oldbr22fn57s,fil_1zzcczhyxo,iPhone4_Gustavo_Fring,2011-06-01 02:48:59,reçu,SMS,Hector Salamanca,Hector,rival,+1-505-4820-3011,,Itinéraire Quai de chargement Madrigal via Lavandería Brillante ; éviter le poste Entrepôt B centre-ville.,"Annexe chimie universitaire, Santa Fe",non,,45,"Heisenberg,azul,pureté"
msg_unxr9zhhm167,fil_y0g1fkoh95,iPhone4_Gustavo_Fring,2011-06-01 07:01:59,reçu,SMS,Lydia Rodarte-Quayle,Lydia,fournisseuse,lydia8311@madrigalcorp.com,,Retard à Dépôt de la ferme avicole ; 83 a vu 54 près de colis.,"Désert – Borne 23, Hobbs",non,,52,"Los Pollos,bleu,colis"
msg_qbxqmew9k9gy,fil_vwk7rx08ud,iPhone4_Gustavo_Fring,2011-06-01 08:13:56,reçu,SMS,Chef de nuit du dépôt,Nuit,logistique,+1-505-8538-8529,,Confirme Bernalillo à transfert près de cuisson.,"Annexe chimie universitaire, Rio Rancho",non,,54,"cuisson,dépôt,manifestes,transfert"
