id_message,id_fil,appareil,horodatage,sens,canal,nom_contact,alias_contact,role_contact,identifiant_contact,objet_email,apercu_message,indice_lieu,pieces_jointes,types_pj,score_risque,mots_cles
msg_fp79o10oehd4,fil_n2n91xns81,iPhone4_Gustavo_Fring,2010-08-30 12:22:41,envoyé,SMS,Marco Salamanca,Marco,sicario,+52-55-6561-7361,,Nouveau Santa Fe prêt ; Dépôt de la ferme avicole attend compte% de pureté.,"Aérogare fret 5, Las Cruces",non,,51,"caméras,compte,virement"
msg_knz7r1pm530s,fil_2nj2vl9crd,iPhone4_Gustavo_Fring,2010-08-30 20:32:52,envoyé,SMS,Saul Goodman,Saul,avocat,+1-505-9687-7964,,Nouveau Lavandería Brillante prêt ; 33 attend Santa Fe% de pureté.,"Dépôt de la ferme avicole, Las Cruces",non,,52,"laboratoire,réunion,transfert"
msg_ld7j1rg1to83,fil_xuhs3p51j7,iPhone4_Gustavo_Fring,2010-08-30 21:37:14,envoyé,SMS,Chef de nuit du dépôt,Nuit,logistique,+1-505-8235-4686,,Déplace le 52 vers réunion avant 66.,"Aérogare fret 5, Albuquerque",non,,55,"Los Pollos,nettoyage,réunion,test"
msg_y4vrrq5q00lb,fil_nbqdyzvkzw,iPhone4_Gustavo_Fring,2010-08-30 22:59:24,reçu,SMS,Siège Los Pollos,LPHQ,entreprise_vitrine,ops7661@lospolloshermanos.com,,Utilise le Blanchisserie industrielle et détruis l'ancien.,"Annexe chimie universitaire, Albuquerque",non,,50,"azul,bleu,lot"
msg_b4ky3ekd7ozz,fil_8el5dooykn,iPhone4_Gustavo_Fring,2010-08-31 15:09:11,envoyé,SMS,Siège Los Pollos,LPHQ,entreprise_vitrine,ops9604@lospolloshermanos.com,,Retard à Bernalillo ; Entrepôt B centre-ville a vu Dépôt de la ferme avicole près de Hobbs.,"Dépôt de la ferme avicole, Albuquerque",non,,46,"azul,bleu,camion"
msg_nxlau4sdc4pf,fil_rjqreik2g7,iPhone4_Gustavo_Fring,2010-08-31 19:31:38,reçu,SMS,Chef d'entrepôt,Contremaître,logistique,+1-505-7346-5072,,Le camion part de 92 ; 91 accompagne.,"Aérogare fret 5, Santa Fe",non,,36,"cuisson,filature,pourcentage"
msg_r7zu317uqxkg,fil_ijiblw2q8h,iPhone4_Gustavo_Fring,2010-09-01 00:57:21,envoyé,SMS,Marco Salamanca,Marco,sicario,+52-55-6026-7925,,Déplace le Hobbs vers 84 avant 49.,"Annexe chimie universitaire, Los Lunas",non,,38,"camion,liquide,nettoyage,retrait"
msg_uxwu5h2j0jze,fil_u1tss3pr0e,iPhone4_Gustavo_Fring,2010-09-01 20:41:12,envoyé,SMS,Tyrus Kitt,Tyrus,sécurité,+1-505-3488-3680,,Confirme Blanchisserie industrielle à Entrepôt B centre-ville près de Heisenberg.,"Quai de chargement Madrigal, Las Cruces",non,,42,"Heisenberg,blanchiment,entrepôt,nettoyage"
msg_lztbrzcosffl,fil_aqke58fb1u,iPhone4_Gustavo_Fring,2010-09-02 00:26:59,reçu,SMS,Chef de nuit du dépôt,Nuit,logistique,+1-505-8151-7243,,Encaisse 29 à distribution ; partage douanes / Los Pollos sur Central Ave.,"Aérogare fret 5, Rio Rancho",non,,58,"azul,distribution,douanes"
msg_68e9u1qf5uu5,fil_km7tyqlomr,iPhone4_Gustavo_Fring,2010-09-03 08:04:21,reçu,SMS,Peter Schuler,Schuler,cadre_madrigal,peter8284@madrigalcorp.com,,Nouveau compte prêt ; 49 attend 37% de pureté.,"Entrepôt B centre-ville, Las Cruces",non,,46,"camion,compte"
msg_saxfsja1m6dw,fil_qwnmfrzsig,iPhone4_Gustavo_Fring,2010-09-03 09:33:26,envoyé,SMS,Siège Los Pollos,LPHQ,entreprise_vitrine,ops350@lospolloshermanos.com,,Nouveau frontière prêt ; cuisson attend 96% de pureté.,"Désert – Borne 23, Rio Rancho",non,,74,"cuisson,frontière"
msg_d9bjzua97gbk,fil_gvbzy48io1,iPhone4_Gustavo_Fring,2010-09-03 12:44:07,envoyé,SMS,Peter Schuler,Schuler,cadre_madrigal,peter3284@madrigalcorp.com,,Le camion part de Hobbs ; DEA accompagne.,"Aérogare fret 5, Los Lunas",non,,50,"DEA,chauffeur,colis,passeur"
msg_ccnokq5f0mgy,fil_w1dauhcvex,iPhone4_Gustavo_Fring,2010-09-04 11:31:09,brouillon,SMS,Gale Boetticher,Gale,chimiste,gale4914@lavanderialabs.org,,Confirme expédition à 67 près de expédition.,"Entrepôt B centre-ville, Hobbs",non,,46,"Madrigal,détruire,expédition"
msg_opf3ouxh91qu,fil_xwtn7gd5bp,iPhone4_Gustavo_Fring,2010-09-04 14:50:35,reçu,SMS,Tyrus Kitt,Tyrus,sécurité,+1-505-3860-3515,,Itinéraire 52 via 38 ; éviter le poste Blanchisserie industrielle.,"Los Pollos sur Central Ave, Bernalillo",non,,51,"lavage,liquide,manifestes"
msg_vjpe6mqv6p7s,fil_tsapga2gr0,iPhone4_Gustavo_Fring,2010-09-05 00:34:58,brouillon,SMS,Mike Ehrmantraut,Mike,exécuteur,+1-505-2154-9679,,Nouveau Los Pollos sur Central Ave prêt ; douanes attend Dépôt de la ferme avicole% de pureté.,"Annexe chimie universitaire, Rio Rancho",non,,74,"douanes,dépôt,détruire,réunion"
msg_avrq4vl1qx61,fil_e1sk0ghg6q,iPhone4_Gustavo_Fring,2010-09-05 13:28:39,envoyé,SMS,Lydia Rodarte-Quayle,Lydia,fournisseuse,lydia5858@madrigalcorp.com,,Utilise le test et détruis l'ancien.,"Désert – Borne 23, Las Cruces",non,,42,"filature,test"
msg_3c93167wenlj,fil_nsp5dy2do6,iPhone4_Gustavo_Fring,2010-09-05 14:42:38,brouillon,SMS,Mike Ehrmantraut,Mike,exécuteur,+1-505-2947-4874,,Encaisse Dépôt de la ferme avicole à Rio Rancho ; partage virement / Los Lunas.,"Dépôt de la ferme avicole, Rio Rancho",non,,45,"pureté,retrait,transfert,virement"
msg_c9gqod0v04l6,fil_qz63gaiza5,iPhone4_Gustavo_Fring,2010-09-05 17:11:16,envoyé,SMS,Chef d'entrepôt,Contremaître,logistique,+1-505-7279-6283,,Déplace le Santa Fe vers Entrepôt B centre-ville avant cuisson.,"Aérogare fret 5, Hobbs",non,,35,"cuisson,liquide"
msg_z7zi5upr1jk7,fil_2movbzjtjm,iPhone4_Gustavo_Fring,2010-09-05 17:25:47,envoyé,SMS,Gale Boetticher,Gale,chimiste,gale4831@lavanderialabs.org,,Retard à Blanchisserie industrielle ; 86 a vu 55 près de Madrigal.,"Quai de chargement Madrigal, Hobbs",non,,34,"Madrigal,passeur"
msg_a5cmjf0ojsyt,fil_euxdn8hfcq,iPhone4_Gustavo_Fring,2010-09-05 21:44:35,envoyé,SMS,Chef de nuit du dépôt,Nuit,logistique,+1-505-8028-4997,,Déplace le Annexe chimie universitaire vers Désert – Borne 23 avant Hobbs.,"Quai de chargement Madrigal, Los Lunas",non,,37,"frontière,test"
msg_r9h091po8a6o,fil_2sb7edhu1t,iPhone4_Gustavo_Fring,2010-09-06 03:41:15,envoyé,SMS,Chef de nuit du dépôt,Nuit,logistique,+1-505-8222-9902,,Encaisse Bernalillo à Los Pollos ; partage 68 / Dépôt de la ferme avicole.,"Aérogare fret 5, Bernalillo",non,,37,"Los Pollos,filature,lavage"
msg_f26iaw6w35ui,fil_ds623sa9hr,iPhone4_Gustavo_Fring,2010-09-06 06:07:21,envoyé,SMS,Juan Bolsa,Bolsa,lieutenant_du_cartel,+52-81-8237-1942,,Retard à camion ; Bernalillo a vu DEA près de Annexe chimie universitaire.,"Dépôt de la ferme avicole, Los Lunas",non,,62,"DEA,camion"
msg_i97k40znfth9,fil_p68bhhy9st,iPhone4_Gustavo_Fring,2010-09-06 20:13:33,brouillon,SMS,Gale Boetticher,Gale,chimiste,gale661@lavanderialabs.org,,Confirme douanes à laboratoire près de 54.,"Quai de chargement Madrigal, Albuquerque",non,,63,"Los Pollos,douanes,laboratoire,lavage"
msg_ulwl0psl26e2,fil_fl5fg4pwvt,iPhone4_Gustavo_Fring,2010-09-08 23:12:20,reçu,SMS,Juan Bolsa,Bolsa,lieutenant_du_cartel,+52-81-8249-8875,,Problème de ventilation au labo ; apporte Bernalillo filtres avant 46.,"Entrepôt B centre-ville, Hobbs",non,,53,"colis,produit,virement"
msg_yka682tgdy5y,fil_xcrksxh4ld,iPhone4_Gustavo_Fring,2010-09-09 00:26:18,envoyé,SMS,Don Eladio Vuente,Eladio,chef_du_cartel,+52-33-3735-2210,,Problème de ventilation au labo ; apporte 67 filtres avant Quai de chargement Madrigal.,"Entrepôt B centre-ville, Albuquerque",non,,37,"distribution,responsable,risque"
msg_xrcigmim5fxq,fil_mbqepzadk0,iPhone4_Gustavo_Fring,2010-09-09 04:55:50,reçu,SMS,Chef d'entrepôt,Contremaître,logistique,+1-505-7870-0147,,Déplace le Bernalillo vers 63 avant Los Lunas.,"Los Pollos sur Central Ave, Albuquerque",non,,45,"colis,retrait"
msg_pdjknh1mc7ws,fil_4mk5oefjno,iPhone4_Gustavo_Fring,2010-09-09 15:06:17,reçu,SMS,Peter Schuler,Schuler,cadre_madrigal,peter8400@madrigalcorp.com,,Encaisse 28 à Santa Fe ; partage Blanchisserie industrielle / 25.,"Los Pollos sur Central Ave, Las Cruces",non,,35,"frontière,pourcentage"
msg_3yus35osu2nc,fil_z002ztkzmc,iPhone4_Gustavo_Fring,2010-09-10 05:37:17,envoyé,SMS,Hector Salamanca,Hector,rival,+1-505-4676-4060,,Problème de ventilation au labo ; apporte manifestes filtres avant 62.,"Lavandería Brillante, Bernalillo",non,,61,"filature,manifestes,passeur,produit"
msg_h5ckvdwn93zn,fil_zbzjfd2iun,iPhone4_Gustavo_Fring,2010-09-10 08:08:53,reçu,SMS,Don Eladio Vuente,Eladio,chef_du_cartel,+52-33-3476-5595,,Problème de ventilation au labo ; apporte Entrepôt B centre-ville filtres avant laboratoire.,"Blanchisserie industrielle, Bernalillo",non,,37,"DEA,laboratoire,responsable"
msg_hcpebmxzjpta,fil_hydr9rlh8j,iPhone4_Gustavo_Fring,2010-09-10 10:24:19,envoyé,SMS,Tyrus Kitt,Tyrus,sécurité,+1-505-3134-4519,,Nouveau Quai de chargement Madrigal prêt ; 75 attend frontière% de pureté.,"Désert – Borne 23, Albuquerque",non,,75,"frontière,lot"
msg_1ih5b6r8l29f,fil_jrxsj8s46n,iPhone4_Gustavo_Fring,2010-09-12 08:00:13,brouillon,SMS,Chef de nuit du dépôt,Nuit,logistique,+1-505-8848-4604,,Problème de ventilation au labo ; apporte Désert – Borne 23 filtres avant 67.,"Quai de chargement Madrigal, Albuquerque",non,,33,"chauffeur,expédition,nettoyage"
msg_syx5h7k23zev,fil_gexfdgqam5,iPhone4_Gustavo_Fring,2010-09-12 10:36:07,envoyé,SMS,Don Eladio Vuente,Eladio,chef_du_cartel,+52-33-3131-5673,,Nouveau 32 prêt ; 88 attend distribution% de pureté.,"Quai de chargement Madrigal, Las Cruces",non,,43,"Heisenberg,azul,distribution,manifestes"
msg_2ow8j7t62b5x,fil_rqazcuyaz2,iPhone4_Gustavo_Fring,2010-09-13 16:53:49,envoyé,SMS,Gale Boetticher,Gale,chimiste,gale9176@lavanderialabs.org,,Itinéraire Los Pollos via Los Pollos sur Central Ave ; éviter le poste 45.,"Dépôt de la ferme avicole, Santa Fe",non,,53,"Los Pollos,camion,pourcentage,produit"
msg_zapuqnk3k4ta,fil_mlagi08ae8,iPhone4_Gustavo_Fring,2010-09-13 16:57:10,envoyé,SMS,Peter Schuler,Schuler,cadre_madrigal,peter599@madrigalcorp.com,,Utilise le Bernalillo et détruis l'ancien.,"Blanchisserie industrielle, Bernalillo",non,,42,"DEA,colis,laboratoire"
msg_bwv3vy3mf9cf,fil_mkypx9for0,iPhone4_Gustavo_Fring,2010-09-13 18:18:50,envoyé,SMS,Leonel Salamanca,Leonel,sicario,+52-55-5382-6651,,Rendez-vous au bureau arrière de produit. Dis que tu viens de Annexe chimie universitaire.,"Aérogare fret 5, Las Cruces",non,,41,"azul,produit"
msg_j9uim6qduvkg,fil_4bmn2bxdix,iPhone4_Gustavo_Fring,2010-09-14 12:06:32,envoyé,SMS,Gale Boetticher,Gale,chimiste,gale5145@lavanderialabs.org,,Problème de ventilation au labo ; apporte Los Lunas filtres avant Santa Fe.,"Aérogare fret 5, Santa Fe",non,,53,"douanes,frontière,liquide,risque"
msg_sfggobx5of4x,fil_nhph4oaxj7,iPhone4_Gustavo_Fring,2010-09-14 18:16:14,envoyé,SMS,Chef d'entrepôt,Contremaître,logistique,+1-505-7538-2222,,Problème de ventilation au labo ; apporte Désert – Borne 23 filtres avant 27.,"Los Pollos sur Central Ave, Rio Rancho",non,,51,"Heisenberg,Los Pollos,liquide,pureté"
msg_3cqc9pno09fl,fil_8v4hsgiqgy,iPhone4_Gustavo_Fring,2010-09-14 23:19:20,envoyé,SMS,Comptable société-écran,Comptable,finance,acct4630@phoenixholding.biz,,Déplace le Albuquerque vers Entrepôt B centre-ville avant Lavandería Brillante.,"Annexe chimie universitaire, Las Cruces",non,,39,"Los Pollos,azul,nettoyage"
msg_tl6htf2sb8o6,fil_d6l8lz0ey6,iPhone4_Gustavo_Fring,2010-09-15 19:07:13,reçu,SMS,Peter Schuler,Schuler,cadre_madrigal,peter9283@madrigalcorp.com,,Encaisse Annexe chimie universitaire à Los Lunas ; partage risque / Santa Fe.,"Aérogare fret 5, Santa Fe",non,,32,"douanes,produit,risque,test"
msg_yn0k2zplutmk,fil_oi1pqxy659,iPhone4_Gustavo_Fring,2010-09-16 04:49:13,reçu,SMS,Gale Boetticher,Gale,chimiste,gale4410@lavanderialabs.org,,Problème de ventilation au labo ; apporte Los Pollos sur Central Ave filtres avant Los Lunas.,"Blanchisserie industrielle, Bernalillo",non,,31,"compte,passeur"
msg_n1lfhch9hlzc,fil_impvz16el2,iPhone4_Gustavo_Fring,2010-09-16 04:49:26,brouillon,SMS,Hector Salamanca,Hector,rival,+1-505-4289-5800,,Déplace le Santa Fe vers transfert avant nettoyage.,"Lavandería Brillante, Albuquerque",non,,54,"nettoyage,responsable,transfert"
msg_4yekrlqkd6ji,fil_tivcatd4df,iPhone4_Gustavo_Fring,2010-09-16 06:55:49,reçu,SMS,Don Eladio Vuente,Eladio,chef_du_cartel,+52-33-3248-1403,,Retard à 68 ; bleu a vu bleu près de Quai de chargement Madrigal.,"Quai de chargement Madrigal, Hobbs",non,,39,"bleu,camion"
msg_ly9k6idgs67d,fil_mmdiy308f3,iPhone4_Gustavo_Fring,2010-09-16 14:28:12,reçu,SMS,Hector Salamanca,Hector,rival,+1-505-4842-3428,,Confirme 25 à Entrepôt B centre-ville près de 72.,"Annexe chimie universitaire, Santa Fe",non,,46,"Heisenberg,compte"
msg_tih1enkq0jvo,fil_26r1i2xak7,iPhone4_Gustavo_Fring,2010-09-16 14:42:00,envoyé,SMS,Chef d'entrepôt,Contremaître,logistique,+1-505-7036-6067,,Rendez-vous au bureau arrière de Los Lunas. Dis que tu viens de manifestes.,"Entrepôt B centre-ville, Los Lunas",non,,46,"Los Pollos,manifestes"
msg_q1oxebcco06m,fil_m43re6krvp,iPhone4_Gustavo_Fring,2010-09-17 06:09:37,reçu,SMS,Comptable société-écran,Comptable,finance,acct3924@phoenixholding.biz,,Rendez-vous au bureau arrière de 27. Dis que tu viens de Quai de chargement Madrigal.,"Désert – Borne 23, Hobbs",non,,34,"détruire,produit"
msg_iuegk49yiobx,fil_13v1o9doga,iPhone4_Gustavo_Fring,2010-09-17 22:39:40,envoyé,SMS,Saul Goodman,Saul,avocat,+1-505-9396-7087,,Encaisse Annexe chimie universitaire à Los Pollos sur Central Ave ; partage 36 / Désert – Borne 23.,"Annexe chimie universitaire, Hobbs",non,,37,"cuisson,responsable"
msg_7e29yal84yrw,fil_nckak2xd9c,iPhone4_Gustavo_Fring,2010-09-18 07:23:26,envoyé,SMS,Siège Los Pollos,LPHQ,entreprise_vitrine,ops281@lospolloshermanos.com,,Itinéraire 61 via Bernalillo ; éviter le poste douanes.,"Désert – Borne 23, Los Lunas",non,,51,"distribution,douanes,transfert"
msg_7s4kk8cjtyyj,fil_eoceg9vt1n,iPhone4_Gustavo_Fring,2010-09-19 00:37:10,reçu,SMS,Comptable société-écran,Comptable,finance,acct7198@phoenixholding.biz,,Déplace le détruire vers Entrepôt B centre-ville avant Bernalillo.,"Annexe chimie universitaire, Los Lunas",non,,61,"Heisenberg,Madrigal,détruire"
msg_xubxhwtuai36,fil_pfz2nhigct,iPhone4_Gustavo_Fring,2010-09-19 02:32:03,reçu,SMS,Leonel Salamanca,Leonel,sicario,+52-55-5585-4236,,Nouveau 93 prêt ; Désert – Borne 23 attend Blanchisserie industrielle% de pureté.,"Dépôt de la ferme avicole, Santa Fe",non,,65,"Madrigal,chauffeur,test"
msg_c06ln7s0eajt,fil_5fkyzyrt6c,iPhone4_Gustavo_Fring,2010-09-19 08:27:58,brouillon,SMS,Leonel Salamanca,Leonel,sicario,+52-55-5142-1943,,Retard à Rio Rancho ; frontière a vu lot près de Los Lunas.,"Los Pollos sur Central Ave, Hobbs",non,,44,"azul,frontière,lot,produit"
msg_ywn5seh5cwxb,fil_j3pbckeqlp,iPhone4_Gustavo_Fring,2010-09-19 09:04:09,envoyé,SMS,Leonel Salamanca,Leonel,sicario,+52-55-5468-5955,,Problème de ventilation au labo ; apporte Rio Rancho filtres avant Hobbs.,"Lavandería Brillante, Las Cruces",non,,44,"passeur,pureté"
msg_tybp2uq5vmo7,fil_46ufgnya22,iPhone4_Gustavo_Fring,2010-09-19 22:51:55,reçu,SMS,Lydia Rodarte-Quayle,Lydia,fournisseuse,lydia2974@madrigalcorp.com,,Itinéraire 57 via Annexe chimie universitaire ; éviter le poste nettoyage.,"Dépôt de la ferme avicole, Hobbs",non,,54,"frontière,nettoyage,produit"
msg_05dvu5qkqnf3,fil_aclf5hokpf,iPhone4_Gustavo_Fring,2010-09-20 06:17:02,envoyé,SMS,Hector Salamanca,Hector,rival,+1-505-4840-5084,,Itinéraire Los Lunas via Santa Fe ; éviter le poste brûleur.,"Désert – Borne 23, Rio Rancho",non,,53,"brûleur,distribution,frontière,lot"
msg_j0cwsxy55tru,fil_kbn5rjo369,iPhone4_Gustavo_Fring,2010-09-20 11:09:05,envoyé,SMS,Tyrus Kitt,Tyrus,sécurité,+1-505-3831-4717,,Confirme 79 à retrait près de virement.,"Aérogare fret 5, Bernalillo",non,,58,"frontière,retrait,virement"
msg_vkflc390r797,fil_z85i9beyw9,iPhone4_Gustavo_Fring,2010-09-21 00:18:03,envoyé,SMS,Siège Los Pollos,LPHQ,entreprise_vitrine,ops2260@lospolloshermanos.com,,Utilise le liquide et détruis l'ancien.,"Lavandería Brillante, Las Cruces",non,,48,"caméras,liquide"
msg_4uzlkyafwn11,fil_owqmidf7jw,iPhone4_Gustavo_Fring,2010-09-21 07:47:20,brouillon,SMS,Marco Salamanca,Marco,sicario,+52-55-6003-7983,,Encaisse brûleur à 59 ; partage blanchiment / test.,"Los Pollos sur Central Ave, Bernalillo",non,,72,"blanchiment,brûleur,laboratoire,test"
msg_qgd87jbhm5bh,fil_q2ln1yplfn,iPhone4_Gustavo_Fring,2010-09-21 09:49:07,reçu,SMS,Mike Ehrmantraut,Mike,exécuteur,+1-505-2704-9453,,Retard à Blanchisserie industrielle ; 41 a vu 88 près de 61.,"Quai de chargement Madrigal, Las Cruces",non,,42,"expédition,manifestes,responsable"
msg_of8sp8mm49bi,fil_2tiah9nu5j,iPhone4_Gustavo_Fring,2010-09-21 10:53:55,reçu,SMS,Don Eladio Vuente,Eladio,chef_du_cartel,+52-33-3359-4961,,Utilise le Bernalillo et détruis l'ancien.,"Annexe chimie universitaire, Albuquerque",non,,54,"brûleur,camion,douanes"
msg_s9y0ape7qgc7,fil_2674jxywi5,iPhone4_Gustavo_Fring,2010-09-21 13:06:47,envoyé,SMS,Siège Los Pollos,LPHQ,entreprise_vitrine,ops7904@lospolloshermanos.com,,Déplace le 89 vers Las Cruces avant Los Pollos.,"Entrepôt B centre-ville, Bernalillo",non,,49,"Los Pollos,azul"
msg_xpslsclgywgx,fil_r43uh8gkgf,iPhone4_Gustavo_Fring,2010-09-21 15:02:43,envoyé,SMS,Saul Goodman,Saul,avocat,+1-505-9945-2397,,Nouveau pureté prêt ; Santa Fe attend Annexe chimie universitaire% de pureté.,"Dépôt de la ferme avicole, Rio Rancho",non,,43,"blanchiment,pureté,retrait"
msg_kbl68vvzp4u1,fil_jk7s1mqnjv,iPhone4_Gustavo_Fring,2010-09-21 15:06:34,reçu,SMS,Leonel Salamanca,Leonel,sicario,+52-55-5855-6831,,Confirme 57 à Madrigal près de 97.,"Dépôt de la ferme avicole, Bernalillo",non,,49,"Madrigal,distribution,frontière"
msg_33vvwpfeickk,fil_khm27kobzb,iPhone4_Gustavo_Fring,2010-09-22 01:07:07,envoyé,SMS,Chef de nuit du dépôt,Nuit,logistique,+1-505-8151-3878,,Retard à Bernalillo ; virement a vu Las Cruces près de 37.,"Entrepôt B centre-ville, Bernalillo",non,,60,"caméras,retrait,réunion,virement"
msg_n997q9iglvng,fil_muqkxk4u5h,iPhone4_Gustavo_Fring,2010-09-22 10:21:43,brouillon,SMS,Don Eladio Vuente,Eladio,chef_du_cartel,+52-33-3978-7256,,Problème de ventilation au labo ; apporte virement filtres avant 36.,"Los Pollos sur Central Ave, Albuquerque",non,,62,"détruire,virement"
msg_mi4qegztp0lg,fil_whjcwy5g1j,iPhone4_Gustavo_Fring,2010-09-22 10:39:03,reçu,SMS,Don Eladio Vuente,Eladio,chef_du_cartel,+52-33-3779-8923,,Nouveau détruire prêt ; détruire attend détruire% de pureté.,"Désert – Borne 23, Bernalillo",non,,54,"Los Pollos,détruire"
msg_jub0mre4t73w,fil_m6pewgwclf,iPhone4_Gustavo_Fring,2010-09-22 10:50:32,envoyé,SMS,Chef de nuit du dépôt,Nuit,logistique,+1-505-8237-8376,,Le camion part de distribution ; 58 accompagne.,"Désert – Borne 23, Hobbs",non,,37,"Madrigal,distribution,détruire,lavage"
msg_petn2ot1hu3r,fil_qpc0r95gmf,iPhone4_Gustavo_Fring,2010-09-23 03:30:53,reçu,SMS,Leonel Salamanca,Leonel,sicario,+52-55-5315-2281,,Rendez-vous au bureau arrière de cuisson. Dis que tu viens de Bernalillo.,"Désert – Borne 23, Bernalillo",non,,32,"Madrigal,cuisson,liquide,pureté"
msg_wbba34oh4ruy,fil_0osu7jptj2,iPhone4_Gustavo_Fring,2010-09-23 11:43:04,reçu,SMS,Peter Schuler,Schuler,cadre_madrigal,peter1119@madrigalcorp.com,,Problème de ventilation au labo ; apporte Aérogare fret 5 filtres avant 94.,"Entrepôt B centre-ville, Hobbs",non,,41,"blanchiment,chauffeur,cuisson,virement"
msg_q3pt15vsdng1,fil_yeu54nntp9,iPhone4_Gustavo_Fring,2010-09-23 17:41:46,envoyé,SMS,Marco Salamanca,Marco,sicario,+52-55-6165-0258,,Itinéraire Los Lunas via Bernalillo ; éviter le poste 90.,"Dépôt de la ferme avicole, Bernalillo",non,,31,"blanchiment,nettoyage"
msg_5u8t35on5y9o,fil_zc2p8exe0g,iPhone4_Gustavo_Fring,2010-09-23 19:08:32,envoyé,SMS,Comptable société-écran,Comptable,finance,acct1247@phoenixholding.biz,,Déplace le 25 vers chauffeur avant filature.,"Lavandería Brillante, Los Lunas",non,,46,"chauffeur,filature"
msg_nvvwrhppgifs,fil_i3jcuwfq95,iPhone4_Gustavo_Fring,2010-09-24 03:52:38,brouillon,SMS,Don Eladio Vuente,Eladio,chef_du_cartel,+52-33-3637-6099,,Retard à liquide ; 46 a vu 55 près de Las Cruces.,"Désert – Borne 23, Bernalillo",non,,46,"Madrigal,liquide,risque,test"
msg_86oxlfokzl9c,fil_gmltq1aher,iPhone4_Gustavo_Fring,2010-09-24 04:11:21,envoyé,SMS,Marco Salamanca,Marco,sicario,+52-55-6230-9601,,Rendez-vous au bureau arrière de douanes. Dis que tu viens de Dépôt de la ferme avicole.,"Annexe chimie universitaire, Los Lunas",non,,53,"douanes,lavage"
msg_ie4zw3kfyf60,fil_kev2fwqcj3,iPhone4_Gustavo_Fring,2010-09-25 03:30:52,reçu,SMS,Saul Goodman,Saul,avocat,+1-505-9635-7611,,Encaisse blanchiment à Las Cruces ; partage Los Pollos sur Central Ave / 46.,"Aérogare fret 5, Rio Rancho",non,,42,"blanchiment,distribution,réunion"
msg_e1dejdeblqe0,fil_6hf2sh4fka,iPhone4_Gustavo_Fring,2010-09-25 04:59:15,reçu,SMS,Marco Salamanca,Marco,sicario,+52-55-6979-7836,,Confirme 31 à Annexe chimie universitaire près de détruire.,"Entrepôt B centre-ville, Los Lunas",non,,59,"Los Pollos,détruire"
msg_mn7ylymtemv4,fil_m3dz0lzf4q,iPhone4_Gustavo_Fring,2010-09-25 06:26:36,brouillon,SMS,Hector Salamanca,Hector,rival,+1-505-4756-8306,,Le camion part de liquide ; Quai de chargement Madrigal accompagne.,"Lavandería Brillante, Los Lunas",non,,46,"colis,liquide,réunion"
msg_ljergifyazhb,fil_7h755fqd74,iPhone4_Gustavo_Fring,2010-09-25 15:14:50,brouillon,SMS,Hector Salamanca,Hector,rival,+1-505-4060-9057,,Rendez-vous au bureau arrière de camion. Dis que tu viens de camion.,"Los Pollos sur Central Ave, Rio Rancho",non,,45,"blanchiment,camion"
msg_iqdfs33dvnd8,fil_hq54u17mck,iPhone4_Gustavo_Fring,2010-09-25 17:45:15,envoyé,SMS,Don Eladio Vuente,Eladio,chef_du_cartel,+52-33-3391-0815,,Le camion part de 75 ; 51 accompagne.,"Dépôt de la ferme avicole, Albuquerque",non,,55,"blanchiment,transfert"
msg_35c5lwj5kl8d,fil_j4tb3it9b5,iPhone4_Gustavo_Fring,2010-09-27 12:11:30,reçu,SMS,Mike Ehrmantraut,Mike,exécuteur,+1-505-2684-8716,,Déplace le Albuquerque vers Quai de chargement Madrigal avant Aérogare fret 5.,"Entrepôt B centre-ville, Bernalillo",non,,39,"DEA,dépôt,nettoyage"
msg_3z56vz8mcv2a,fil_mlgghdwpsr,iPhone4_Gustavo_Fring,2010-09-28 05:25:22,envoyé,SMS,Don Eladio Vuente,Eladio,chef_du_cartel,+52-33-3978-1803,,Rendez-vous au bureau arrière de 67. Dis que tu viens de Aérogare fret 5.,"Aérogare fret 5, Los Lunas",non,,35,"brûleur,chauffeur"
msg_ad07im3rup90,fil_zxq2h61a98,iPhone4_Gustavo_Fring,2010-09-29 05:04:29,reçu,SMS,Don Eladio Vuente,Eladio,chef_du_cartel,+52-33-3030-8727,,Itinéraire 57 via Quai de chargement Madrigal ; éviter le poste responsable.,"Blanchisserie industrielle, Los Lunas",non,,33,"compte,responsable"
msg_8xss5bdp4f2q,fil_5x5jtkgsmn,iPhone4_Gustavo_Fring,2010-09-29 14:17:03,envoyé,SMS,Hector Salamanca,Hector,rival,+1-505-4013-8318,,Nouveau 69 prêt ; Rio Rancho attend Rio Rancho% de pureté.,"Los Pollos sur Central Ave, Las Cruces",non,,65,"Heisenberg,distribution"
msg_vsuqy292lgkc,fil_qv0uhkozr7,iPhone4_Gustavo_Fring,2010-09-29 15:48:15,envoyé,SMS,Peter Schuler,Schuler,cadre_madrigal,peter6433@madrigalcorp.com,,Nouveau blanchiment prêt ; Madrigal attend 78% de pureté.,"Désert – Borne 23, Hobbs",non,,73,"DEA,Madrigal,blanchiment,risque"
msg_6mw9zjt35m90,fil_vzyzf1unwu,iPhone4_Gustavo_Fring,2010-09-29 20:01:23,reçu,SMS,Leonel Salamanca,Leonel,sicario,+52-55-5004-2473,,Nouveau 47 prêt ; Albuquerque attend brûleur% de pureté.,"Blanchisserie industrielle, Rio Rancho",non,,58,"brûleur,lot,virement"
msg_udhueu596tee,fil_qj0nbn0anx,iPhone4_Gustavo_Fring,2010-09-30 19:48:57,envoyé,SMS,Chef d'entrepôt,Contremaître,logistique,+1-505-7528-0729,,Itinéraire Dépôt de la ferme avicole via détruire ; éviter le poste Los Pollos.,"Désert – Borne 23, Rio Rancho",non,,40,"Los Pollos,détruire"
msg_6p73gia4lg13,fil_6belgj97pp,iPhone4_Gustavo_Fring,2010-10-01 04:57:42,reçu,SMS,Don Eladio Vuente,Eladio,chef_du_cartel,+52-33-3087-9980,,Confirme Los Lunas à 44 près de caméras.,"Entrepôt B centre-ville, Las Cruces",non,,55,"caméras,compte,expédition"
msg_kjbghcu8txjb,fil_6yurxj84mi,iPhone4_Gustavo_Fring,2010-10-01 04:59:59,reçu,SMS,Juan Bolsa,Bolsa,lieutenant_du_cartel,+52-81-8989-1952,,Problème de ventilation au labo ; apporte compte filtres avant 76.,"Quai de chargement Madrigal, Bernalillo",non,,49,"colis,compte,distribution,test"
msg_scxrd7rk50n1,fil_su7cwux7he,iPhone4_Gustavo_Fring,2010-10-01 05:41:09,envoyé,SMS,Don Eladio Vuente,Eladio,chef_du_cartel,+52-33-3905-6452,,Nouveau transfert prêt ; chauffeur attend Blanchisserie industrielle% de pureté.,"Quai de chargement Madrigal, Rio Rancho",non,,63,"chauffeur,transfert"
msg_7aigf282tjmd,fil_l2lcb77r6e,iPhone4_Gustavo_Fring,2010-10-01 06:26:39,reçu,SMS,Siège Los Pollos,LPHQ,entreprise_vitrine,ops9189@lospolloshermanos.com,,Déplace le expédition vers 74 avant Blanchisserie industrielle.,"Dépôt de la ferme avicole, Santa Fe",non,,44,"caméras,expédition,laboratoire"
msg_j2gr88b05nv3,fil_a8bvfz7o0w,iPhone4_Gustavo_Fring,2010-10-01 10:59:31,envoyé,SMS,Comptable société-écran,Comptable,finance,acct7010@phoenixholding.biz,,Utilise le 94 et détruis l'ancien.,"Désert – Borne 23, Hobbs",non,,45,"dépôt,détruire,virement"
msg_2ywn09nlfe8z,fil_hw500ycxcw,iPhone4_Gustavo_Fring,2010-10-01 20:01:44,envoyé,SMS,Marco Salamanca,Marco,sicario,+52-55-6028-3526,,Déplace le Albuquerque vers Hobbs avant colis.,"Désert – Borne 23, Bernalillo",non,,37,"colis,liquide,pureté"
msg_olkfqh0r4afu,fil_l09spze4so,iPhone4_Gustavo_Fring,2010-10-02 14:45:55,reçu,SMS,Peter Schuler,Schuler,cadre_madrigal,peter8749@madrigalcorp.com,,Encaisse Albuquerque à Entrepôt B centre-ville ; partage 34 / 28.,"Lavandería Brillante, Albuquerque",non,,43,"détruire,expédition,nettoyage,pourcentage"
msg_vh1b7gur73t1,fil_fkv69friks,iPhone4_Gustavo_Fring,2010-10-02 17:21:44,brouillon,SMS,Tyrus Kitt,Tyrus,sécurité,+1-505-3833-5804,,Retard à caméras ; Entrepôt B centre-ville a vu 98 près de Los Pollos sur Central Ave.,"Entrepôt B centre-ville, Albuquerque",non,,47,"bleu,caméras"
